Log initialization test: 11/17/2024 18:43:19
2024-11-17 18:43:19: ½ºÅ©¸³Æ® ½ÃÀÛ - °æ·Î: C:\Users\woods\development\HMProject\vdi_backend\src\main\resources\scripts
2024-11-17 18:43:19: ·Î±× µğ·ºÅä¸®: C:\Users\woods\development\HMProject\vdi_backend\src\main\resources\scripts\logs
2024-11-17 18:43:19: ½ÃÀÛ: AD »ç¿ëÀÚ »ı¼º - UserID: dh2359, Name: Çü·¡ Á¶
2024-11-17 18:43:19: ¿ø°İ ¿¬°á ¼³Á¤ ½Ãµµ - Server: 192.168.111.10, Username: administrator@hanbit.com
2024-11-17 18:43:19: ¿ø°İ ¼¼¼Ç »ı¼º ½Ãµµ
2024-11-17 18:43:19: ¿ø°İ ¼¼¼Ç »ı¼º ¼º°ø
2024-11-17 18:43:19: AD »ç¿ëÀÚ »ı¼º ¸í·É ½ÇÇà ½ÃÀÛ
Log initialization test: 11/17/2024 18:48:10
2024-11-17 18:48:10: ìŠ¤í¬ë¦½íŠ¸ ì‹œì‘ - ê²½ë¡œ: C:\Users\woods\development\HMProject\vdi_backend\src\main\resources\scripts
2024-11-17 18:48:10: ë¡œê·¸ ë””ë ‰í† ë¦¬: C:\Users\woods\development\HMProject\vdi_backend\src\main\resources\scripts\logs
2024-11-17 18:48:10: ì‹œì‘: AD ì‚¬ìš©ì ìƒì„± - UserID: dh2359, Name: í˜•ë˜ ì¡°
2024-11-17 18:48:10: ì›ê²© ì—°ê²° ì„¤ì • ì‹œë„ - Server: 192.168.111.10, Username: administrator@hanbit.com
2024-11-17 18:48:10: ì›ê²© ì„¸ì…˜ ìƒì„± ì‹œë„
2024-11-17 18:48:11: ì›ê²© ì„¸ì…˜ ìƒì„± ì„±ê³µ
2024-11-17 18:48:11: AD ì‚¬ìš©ì ìƒì„± ëª…ë ¹ ì‹¤í–‰ ì‹œì‘
Log initialization test: 11/17/2024 18:51:15
2024-11-17 18:51:15: ìŠ¤í¬ë¦½íŠ¸ ì‹œì‘ - ê²½ë¡œ: C:\Users\woods\development\HMProject\vdi_backend\src\main\resources\scripts
2024-11-17 18:51:15: ë¡œê·¸ ë””ë ‰í† ë¦¬: C:\Users\woods\development\HMProject\vdi_backend\src\main\resources\scripts\logs
2024-11-17 18:51:15: ì‹œì‘: AD ì‚¬ìš©ì ìƒì„± - UserID: dh2359, Name: í˜•ë˜ ì¡°
2024-11-17 18:51:15: ì›ê²© ì—°ê²° ì„¤ì • ì‹œë„ - Server: 192.168.111.10, Username: administrator@hanbit.com
2024-11-17 18:51:15: ìê²© ì¦ëª… ìƒì„± ì„±ê³µ
2024-11-17 18:51:15: ì›ê²© ì„œë²„ ì—°ê²° í…ŒìŠ¤íŠ¸ ì‹œì‘
2024-11-17 18:51:15: ì›ê²© ì„œë²„ ì—°ê²° í…ŒìŠ¤íŠ¸ ì„±ê³µ
2024-11-17 18:51:15: ì›ê²© ì„¸ì…˜ ìƒì„± ì‹œë„
Log initialization test: 11/17/2024 18:55:38
2024-11-17 18:55:38: ìŠ¤í¬ë¦½íŠ¸ ì‹œì‘ - ê²½ë¡œ: C:\Users\woods\development\HMProject\vdi_backend\src\main\resources\scripts
2024-11-17 18:55:38: ë¡œê·¸ ë””ë ‰í† ë¦¬: C:\Users\woods\development\HMProject\vdi_backend\src\main\resources\scripts\logs
2024-11-17 18:55:38: ì‹œì‘: AD ì‚¬ìš©ì ìƒì„± - UserID: dh2359, Name: í˜•ë˜ ì¡°
2024-11-17 18:55:38: ì›ê²© ì—°ê²° ì„¤ì • ì‹œë„ - Server: 192.168.111.10, Username: administrator@hanbit.com
2024-11-17 18:55:38: ìê²© ì¦ëª… ìƒì„± ì„±ê³µ
2024-11-17 18:55:38: ì›ê²© ì„œë²„ ì—°ê²° í…ŒìŠ¤íŠ¸ ì‹œì‘
2024-11-17 18:55:38: ì›ê²© ì„œë²„ ì—°ê²° í…ŒìŠ¤íŠ¸ ì„±ê³µ
2024-11-17 18:55:38: ì›ê²© ì„¸ì…˜ ìƒì„± ì‹œë„
2024-11-17 18:55:38: ì›ê²© ì„¸ì…˜ ìƒì„± ì„±ê³µ (SessionId: 1)
2024-11-17 18:55:38: ì„¸ì…˜ ìƒíƒœ í™•ì¸ ì™„ë£Œ
2024-11-17 18:55:38: AD ì‚¬ìš©ì ìƒì„± ëª…ë ¹ ì‹¤í–‰ ì‹œì‘
Log initialization test: 11/17/2024 18:58:44
2024-11-17 18:58:44: ìŠ¤í¬ë¦½íŠ¸ ì‹œì‘ - ê²½ë¡œ: C:\Users\woods\development\HMProject\vdi_backend\src\main\resources\scripts
2024-11-17 18:58:44: ë¡œê·¸ ë””ë ‰í† ë¦¬: C:\Users\woods\development\HMProject\vdi_backend\src\main\resources\scripts\logs
2024-11-17 18:58:44: ì‹œì‘: AD ì‚¬ìš©ì ìƒì„± - UserID: dh2359, Name: í˜•ë˜ ì¡°
2024-11-17 18:58:44: ì›ê²© ì—°ê²° ì„¤ì • ì‹œë„ - Server: 192.168.111.10, Username: administrator@hanbit.com
2024-11-17 18:58:44: ìê²© ì¦ëª… ìƒì„± ì„±ê³µ
2024-11-17 18:58:44: ì›ê²© ì„œë²„ ì—°ê²° í…ŒìŠ¤íŠ¸ ì‹œì‘
2024-11-17 18:58:44: ì›ê²© ì„œë²„ ì—°ê²° í…ŒìŠ¤íŠ¸ ì„±ê³µ
2024-11-17 18:58:44: ì›ê²© ì„¸ì…˜ ìƒì„± ì‹œë„
2024-11-17 18:58:44: ì›ê²© ì„¸ì…˜ ìƒì„± ì„±ê³µ (SessionId: 1)
2024-11-17 18:58:44: ì„¸ì…˜ ìƒíƒœ í™•ì¸ ì™„ë£Œ
2024-11-17 18:58:44: AD ì‚¬ìš©ì ìƒì„± ëª…ë ¹ ì‹¤í–‰ ì‹œì‘
2024-11-17 18:58:45: ì›ê²© ì„¸ì…˜ ì¢…ë£Œ
2024-11-17 18:58:45: ì‚¬ìš©ì ìƒì„± ì™„ë£Œ: dh2359
Log initialization test: 11/17/2024 19:21:10
2024-11-17 19:21:10: ìŠ¤í¬ë¦½íŠ¸ ì‹œì‘ - ê²½ë¡œ: C:\Users\woods\development\HMProject\vdi_backend\src\main\resources\scripts
2024-11-17 19:21:10: ë¡œê·¸ ë””ë ‰í† ë¦¬: C:\Users\woods\development\HMProject\vdi_backend\src\main\resources\scripts\logs
2024-11-17 19:21:10: ì‹œì‘: AD ì‚¬ìš©ì ìƒì„± - UserID: skb, Name: ì¢…í˜„ ê¹€
2024-11-17 19:21:10: ì›ê²© ì—°ê²° ì„¤ì • ì‹œë„ - Server: 192.168.111.10, Username: administrator@hanbit.com
2024-11-17 19:21:10: ìê²© ì¦ëª… ìƒì„± ì„±ê³µ
2024-11-17 19:21:10: ì›ê²© ì„œë²„ ì—°ê²° í…ŒìŠ¤íŠ¸ ì‹œì‘
2024-11-17 19:21:10: ì›ê²© ì„œë²„ ì—°ê²° í…ŒìŠ¤íŠ¸ ì„±ê³µ
2024-11-17 19:21:10: ì›ê²© ì„¸ì…˜ ìƒì„± ì‹œë„
2024-11-17 19:21:10: ì›ê²© ì„¸ì…˜ ìƒì„± ì„±ê³µ (SessionId: 1)
2024-11-17 19:21:10: ì„¸ì…˜ ìƒíƒœ í™•ì¸ ì™„ë£Œ
2024-11-17 19:21:10: AD ì‚¬ìš©ì ìƒì„± ëª…ë ¹ ì‹¤í–‰ ì‹œì‘
2024-11-17 19:21:11: ì›ê²© ì„¸ì…˜ ì¢…ë£Œ
2024-11-17 19:21:11: ì‚¬ìš©ì ìƒì„± ì™„ë£Œ: skb
Log initialization test: 11/17/2024 19:28:43
2024-11-17 19:28:43: ìŠ¤í¬ë¦½íŠ¸ ì‹œì‘ - ê²½ë¡œ: C:\Users\woods\development\HMProject\vdi_backend\src\main\resources\scripts
2024-11-17 19:28:43: ë¡œê·¸ ë””ë ‰í† ë¦¬: C:\Users\woods\development\HMProject\vdi_backend\src\main\resources\scripts\logs
2024-11-17 19:28:43: ì‹œì‘: AD ì‚¬ìš©ì ìƒì„± - UserID: kms, Name: ë¯¼ìˆ˜ ê¹€
2024-11-17 19:28:43: ì›ê²© ì—°ê²° ì„¤ì • ì‹œë„ - Server: 192.168.111.10, Username: administrator@hanbit.com
2024-11-17 19:28:43: ìê²© ì¦ëª… ìƒì„± ì„±ê³µ
2024-11-17 19:28:43: ì›ê²© ì„œë²„ ì—°ê²° í…ŒìŠ¤íŠ¸ ì‹œì‘
2024-11-17 19:28:43: ì›ê²© ì„œë²„ ì—°ê²° í…ŒìŠ¤íŠ¸ ì„±ê³µ
2024-11-17 19:28:43: ì›ê²© ì„¸ì…˜ ìƒì„± ì‹œë„
2024-11-17 19:28:43: ì›ê²© ì„¸ì…˜ ìƒì„± ì„±ê³µ (SessionId: 1)
2024-11-17 19:28:43: ì„¸ì…˜ ìƒíƒœ í™•ì¸ ì™„ë£Œ
2024-11-17 19:28:43: AD ì‚¬ìš©ì ìƒì„± ëª…ë ¹ ì‹¤í–‰ ì‹œì‘
2024-11-17 19:28:44: ì›ê²© ì„¸ì…˜ ì¢…ë£Œ
2024-11-17 19:28:44: ì‚¬ìš©ì ìƒì„± ì™„ë£Œ: kms
Log initialization test: 11/17/2024 19:35:18
2024-11-17 19:35:18: ìŠ¤í¬ë¦½íŠ¸ ì‹œì‘ - ê²½ë¡œ: C:\Users\woods\development\HMProject\vdi_backend\src\main\resources\scripts
2024-11-17 19:35:18: ë¡œê·¸ ë””ë ‰í† ë¦¬: C:\Users\woods\development\HMProject\vdi_backend\src\main\resources\scripts\logs
2024-11-17 19:35:18: ì‹œì‘: AD ì‚¬ìš©ì ìƒì„± - UserID: kms, Name: ë¯¼ìˆ˜ ê¹€
2024-11-17 19:35:18: ì›ê²© ì—°ê²° ì„¤ì • ì‹œë„ - Server: 192.168.111.10, Username: administrator@hanbit.com
2024-11-17 19:35:18: ìê²© ì¦ëª… ìƒì„± ì„±ê³µ
2024-11-17 19:35:18: ì›ê²© ì„œë²„ ì—°ê²° í…ŒìŠ¤íŠ¸ ì‹œì‘
2024-11-17 19:35:18: ì›ê²© ì„œë²„ ì—°ê²° í…ŒìŠ¤íŠ¸ ì„±ê³µ
2024-11-17 19:35:18: ì›ê²© ì„¸ì…˜ ìƒì„± ì‹œë„
2024-11-17 19:35:18: ì›ê²© ì„¸ì…˜ ìƒì„± ì„±ê³µ (SessionId: 1)
2024-11-17 19:35:18: ì„¸ì…˜ ìƒíƒœ í™•ì¸ ì™„ë£Œ
2024-11-17 19:35:18: AD ì‚¬ìš©ì ìƒì„± ëª…ë ¹ ì‹¤í–‰ ì‹œì‘
2024-11-17 19:35:19: ì›ê²© ì„¸ì…˜ ì¢…ë£Œ
2024-11-17 19:35:19: ì‚¬ìš©ì ìƒì„± ì™„ë£Œ: kms
Log initialization test: 11/17/2024 19:42:17
2024-11-17 19:42:17: ìŠ¤í¬ë¦½íŠ¸ ì‹œì‘ - ê²½ë¡œ: C:\Users\woods\development\HMProject\vdi_backend\src\main\resources\scripts
2024-11-17 19:42:17: ë¡œê·¸ ë””ë ‰í† ë¦¬: C:\Users\woods\development\HMProject\vdi_backend\src\main\resources\scripts\logs
2024-11-17 19:42:17: ì‹œì‘: AD ì‚¬ìš©ì ìƒì„± - UserID: kms, Name: ë¯¼ìˆ˜ ê¹€
2024-11-17 19:42:17: ì›ê²© ì—°ê²° ì„¤ì • ì‹œë„ - Server: 192.168.111.10, Username: administrator@hanbit.com
2024-11-17 19:42:17: ìê²© ì¦ëª… ìƒì„± ì„±ê³µ
2024-11-17 19:42:17: ì›ê²© ì„œë²„ ì—°ê²° í…ŒìŠ¤íŠ¸ ì‹œì‘
2024-11-17 19:42:17: ì›ê²© ì„œë²„ ì—°ê²° í…ŒìŠ¤íŠ¸ ì„±ê³µ
2024-11-17 19:42:17: ì›ê²© ì„¸ì…˜ ìƒì„± ì‹œë„
2024-11-17 19:42:18: ì›ê²© ì„¸ì…˜ ìƒì„± ì„±ê³µ (SessionId: 1)
2024-11-17 19:42:18: ì„¸ì…˜ ìƒíƒœ í™•ì¸ ì™„ë£Œ
2024-11-17 19:42:18: AD ì‚¬ìš©ì ìƒì„± ëª…ë ¹ ì‹¤í–‰ ì‹œì‘
2024-11-17 19:42:19: ì›ê²© ì„¸ì…˜ ì¢…ë£Œ
2024-11-17 19:42:19: ì‚¬ìš©ì ìƒì„± ì™„ë£Œ: kms
Log initialization test: 11/17/2024 19:46:16
2024-11-17 19:46:16: ìŠ¤í¬ë¦½íŠ¸ ì‹œì‘ - ê²½ë¡œ: C:\Users\woods\development\HMProject\vdi_backend\src\main\resources\scripts
2024-11-17 19:46:16: ë¡œê·¸ ë””ë ‰í† ë¦¬: C:\Users\woods\development\HMProject\vdi_backend\src\main\resources\scripts\logs
2024-11-17 19:46:16: ì‹œì‘: AD ì‚¬ìš©ì ìƒì„± - UserID: kms, Name: ë¯¼ìˆ˜ ê¹€
2024-11-17 19:46:16: ì›ê²© ì—°ê²° ì„¤ì • ì‹œë„ - Server: 192.168.111.10, Username: administrator@hanbit.com
2024-11-17 19:46:16: ìê²© ì¦ëª… ìƒì„± ì„±ê³µ
2024-11-17 19:46:16: ì›ê²© ì„œë²„ ì—°ê²° í…ŒìŠ¤íŠ¸ ì‹œì‘
2024-11-17 19:46:16: ì›ê²© ì„œë²„ ì—°ê²° í…ŒìŠ¤íŠ¸ ì„±ê³µ
2024-11-17 19:46:16: ì›ê²© ì„¸ì…˜ ìƒì„± ì‹œë„
2024-11-17 19:46:16: ì›ê²© ì„¸ì…˜ ìƒì„± ì„±ê³µ (SessionId: 1)
2024-11-17 19:46:16: ì„¸ì…˜ ìƒíƒœ í™•ì¸ ì™„ë£Œ
2024-11-17 19:46:16: AD ì‚¬ìš©ì ìƒì„± ëª…ë ¹ ì‹¤í–‰ ì‹œì‘
2024-11-17 19:46:17: ì›ê²© ì„¸ì…˜ ì¢…ë£Œ
2024-11-17 19:46:17: ì‚¬ìš©ì ìƒì„± ì™„ë£Œ: kms
Log initialization test: 11/17/2024 19:48:52
2024-11-17 19:48:52: ìŠ¤í¬ë¦½íŠ¸ ì‹œì‘ - ê²½ë¡œ: C:\Users\woods\development\HMProject\vdi_backend\src\main\resources\scripts
2024-11-17 19:48:52: ë¡œê·¸ ë””ë ‰í† ë¦¬: C:\Users\woods\development\HMProject\vdi_backend\src\main\resources\scripts\logs
2024-11-17 19:48:52: ì‹œì‘: AD ì‚¬ìš©ì ìƒì„± - UserID: kms, Name: ë¯¼ìˆ˜ ê¹€
2024-11-17 19:48:52: ì›ê²© ì—°ê²° ì„¤ì • ì‹œë„ - Server: 192.168.111.10, Username: administrator@hanbit.com
2024-11-17 19:48:52: ìê²© ì¦ëª… ìƒì„± ì„±ê³µ
2024-11-17 19:48:52: ì›ê²© ì„œë²„ ì—°ê²° í…ŒìŠ¤íŠ¸ ì‹œì‘
2024-11-17 19:48:52: ì›ê²© ì„œë²„ ì—°ê²° í…ŒìŠ¤íŠ¸ ì„±ê³µ
2024-11-17 19:48:52: ì›ê²© ì„¸ì…˜ ìƒì„± ì‹œë„
2024-11-17 19:48:53: ì›ê²© ì„¸ì…˜ ìƒì„± ì„±ê³µ (SessionId: 1)
2024-11-17 19:48:53: ì„¸ì…˜ ìƒíƒœ í™•ì¸ ì™„ë£Œ
2024-11-17 19:48:53: AD ì‚¬ìš©ì ìƒì„± ëª…ë ¹ ì‹¤í–‰ ì‹œì‘
2024-11-17 19:48:53: ì›ê²© ì„¸ì…˜ ì¢…ë£Œ
2024-11-17 19:48:53: ì‚¬ìš©ì ìƒì„± ì™„ë£Œ: kms
Log initialization test: 11/17/2024 19:52:31
2024-11-17 19:52:31: ìŠ¤í¬ë¦½íŠ¸ ì‹œì‘ - ê²½ë¡œ: C:\Users\woods\development\HMProject\vdi_backend\src\main\resources\scripts
2024-11-17 19:52:31: ë¡œê·¸ ë””ë ‰í† ë¦¬: C:\Users\woods\development\HMProject\vdi_backend\src\main\resources\scripts\logs
2024-11-17 19:52:31: ì‹œì‘: AD ì‚¬ìš©ì ìƒì„± - UserID: kms, Name: ë¯¼ìˆ˜ ê¹€
2024-11-17 19:52:31: ì›ê²© ì—°ê²° ì„¤ì • ì‹œë„ - Server: 192.168.111.10, Username: administrator@hanbit.com
2024-11-17 19:52:31: ìê²© ì¦ëª… ìƒì„± ì„±ê³µ
2024-11-17 19:52:31: ì›ê²© ì„œë²„ ì—°ê²° í…ŒìŠ¤íŠ¸ ì‹œì‘
2024-11-17 19:52:31: ì›ê²© ì„œë²„ ì—°ê²° í…ŒìŠ¤íŠ¸ ì„±ê³µ
2024-11-17 19:52:31: ì›ê²© ì„¸ì…˜ ìƒì„± ì‹œë„
2024-11-17 19:52:31: ì›ê²© ì„¸ì…˜ ìƒì„± ì„±ê³µ (SessionId: 1)
2024-11-17 19:52:31: ì„¸ì…˜ ìƒíƒœ í™•ì¸ ì™„ë£Œ
2024-11-17 19:52:31: AD ì‚¬ìš©ì ìƒì„± ëª…ë ¹ ì‹¤í–‰ ì‹œì‘
2024-11-17 19:52:32: ì›ê²© ì„¸ì…˜ ì¢…ë£Œ
2024-11-17 19:52:32: ì‚¬ìš©ì ìƒì„± ì™„ë£Œ: kms
Log initialization test: 11/17/2024 19:55:56
2024-11-17 19:55:56: ìŠ¤í¬ë¦½íŠ¸ ì‹œì‘ - ê²½ë¡œ: C:\Users\woods\development\HMProject\vdi_backend\src\main\resources\scripts
2024-11-17 19:55:56: ë¡œê·¸ ë””ë ‰í† ë¦¬: C:\Users\woods\development\HMProject\vdi_backend\src\main\resources\scripts\logs
2024-11-17 19:55:56: ì‹œì‘: AD ì‚¬ìš©ì ìƒì„± - UserID: kms, Name: ë¯¼ìˆ˜ ê¹€
2024-11-17 19:55:56: ì›ê²© ì—°ê²° ì„¤ì • ì‹œë„ - Server: 192.168.111.10, Username: administrator@hanbit.com
2024-11-17 19:55:56: ìê²© ì¦ëª… ìƒì„± ì„±ê³µ
2024-11-17 19:55:56: ì›ê²© ì„œë²„ ì—°ê²° í…ŒìŠ¤íŠ¸ ì‹œì‘
2024-11-17 19:55:57: ì›ê²© ì„œë²„ ì—°ê²° í…ŒìŠ¤íŠ¸ ì„±ê³µ
2024-11-17 19:55:57: ì›ê²© ì„¸ì…˜ ìƒì„± ì‹œë„
2024-11-17 19:55:57: ì›ê²© ì„¸ì…˜ ìƒì„± ì„±ê³µ (SessionId: 1)
2024-11-17 19:55:57: ì„¸ì…˜ ìƒíƒœ í™•ì¸ ì™„ë£Œ
2024-11-17 19:55:57: AD ì‚¬ìš©ì ìƒì„± ëª…ë ¹ ì‹¤í–‰ ì‹œì‘
2024-11-17 19:55:58: ì›ê²© ì„¸ì…˜ ì¢…ë£Œ
2024-11-17 19:55:58: ì‚¬ìš©ì ìƒì„± ì™„ë£Œ: kms
Log initialization test: 11/17/2024 19:57:11
2024-11-17 19:57:11: ìŠ¤í¬ë¦½íŠ¸ ì‹œì‘ - ê²½ë¡œ: C:\Users\woods\development\HMProject\vdi_backend\src\main\resources\scripts
2024-11-17 19:57:11: ë¡œê·¸ ë””ë ‰í† ë¦¬: C:\Users\woods\development\HMProject\vdi_backend\src\main\resources\scripts\logs
2024-11-17 19:57:11: ì‹œì‘: AD ì‚¬ìš©ì ìƒì„± - UserID: kms, Name: ë¯¼ìˆ˜ ê¹€
2024-11-17 19:57:11: ì›ê²© ì—°ê²° ì„¤ì • ì‹œë„ - Server: 192.168.111.10, Username: administrator@hanbit.com
2024-11-17 19:57:11: ìê²© ì¦ëª… ìƒì„± ì„±ê³µ
2024-11-17 19:57:11: ì›ê²© ì„œë²„ ì—°ê²° í…ŒìŠ¤íŠ¸ ì‹œì‘
2024-11-17 19:57:11: ì›ê²© ì„œë²„ ì—°ê²° í…ŒìŠ¤íŠ¸ ì„±ê³µ
2024-11-17 19:57:11: ì›ê²© ì„¸ì…˜ ìƒì„± ì‹œë„
2024-11-17 19:57:11: ì›ê²© ì„¸ì…˜ ìƒì„± ì„±ê³µ (SessionId: 1)
2024-11-17 19:57:11: ì„¸ì…˜ ìƒíƒœ í™•ì¸ ì™„ë£Œ
2024-11-17 19:57:11: AD ì‚¬ìš©ì ìƒì„± ëª…ë ¹ ì‹¤í–‰ ì‹œì‘
2024-11-17 19:57:12: ì›ê²© ì„¸ì…˜ ì¢…ë£Œ
2024-11-17 19:57:12: ì‚¬ìš©ì ìƒì„± ì™„ë£Œ: kms
Log initialization test: 11/17/2024 19:59:10
2024-11-17 19:59:10: ìŠ¤í¬ë¦½íŠ¸ ì‹œì‘ - ê²½ë¡œ: C:\Users\woods\development\HMProject\vdi_backend\src\main\resources\scripts
2024-11-17 19:59:10: ë¡œê·¸ ë””ë ‰í† ë¦¬: C:\Users\woods\development\HMProject\vdi_backend\src\main\resources\scripts\logs
2024-11-17 19:59:10: ì‹œì‘: AD ì‚¬ìš©ì ìƒì„± - UserID: kms, Name: ë¯¼ìˆ˜ ê¹€
2024-11-17 19:59:10: ì›ê²© ì—°ê²° ì„¤ì • ì‹œë„ - Server: 192.168.111.10, Username: administrator@hanbit.com
2024-11-17 19:59:10: ìê²© ì¦ëª… ìƒì„± ì„±ê³µ
2024-11-17 19:59:10: ì›ê²© ì„œë²„ ì—°ê²° í…ŒìŠ¤íŠ¸ ì‹œì‘
2024-11-17 19:59:10: ì›ê²© ì„œë²„ ì—°ê²° í…ŒìŠ¤íŠ¸ ì„±ê³µ
2024-11-17 19:59:10: ì›ê²© ì„¸ì…˜ ìƒì„± ì‹œë„
2024-11-17 19:59:10: ì›ê²© ì„¸ì…˜ ìƒì„± ì„±ê³µ (SessionId: 1)
2024-11-17 19:59:10: ì„¸ì…˜ ìƒíƒœ í™•ì¸ ì™„ë£Œ
2024-11-17 19:59:10: AD ì‚¬ìš©ì ìƒì„± ëª…ë ¹ ì‹¤í–‰ ì‹œì‘
2024-11-17 19:59:11: ì›ê²© ì„¸ì…˜ ì¢…ë£Œ
2024-11-17 19:59:11: ì‚¬ìš©ì ìƒì„± ì™„ë£Œ: kms
Log initialization test: 11/17/2024 20:28:24
2024-11-17 20:28:24: ìŠ¤í¬ë¦½íŠ¸ ì‹œì‘ - ê²½ë¡œ: C:\Users\woods\development\HMProject\vdi_backend\src\main\resources\scripts
2024-11-17 20:28:24: ë¡œê·¸ ë””ë ‰í† ë¦¬: C:\Users\woods\development\HMProject\vdi_backend\src\main\resources\scripts\logs
2024-11-17 20:28:24: ì‹œì‘: AD ì‚¬ìš©ì ìƒì„± - UserID: kms, Name: ë¯¼ìˆ˜ ê¹€
2024-11-17 20:28:24: ì›ê²© ì—°ê²° ì„¤ì • ì‹œë„ - Server: 192.168.111.10, Username: administrator@hanbit.com
2024-11-17 20:28:24: ìê²© ì¦ëª… ìƒì„± ì„±ê³µ
2024-11-17 20:28:24: ì›ê²© ì„œë²„ ì—°ê²° í…ŒìŠ¤íŠ¸ ì‹œì‘
2024-11-17 20:28:24: ì›ê²© ì„œë²„ ì—°ê²° í…ŒìŠ¤íŠ¸ ì„±ê³µ
2024-11-17 20:28:24: ì›ê²© ì„¸ì…˜ ìƒì„± ì‹œë„
2024-11-17 20:28:24: ì›ê²© ì„¸ì…˜ ìƒì„± ì„±ê³µ (SessionId: 1)
2024-11-17 20:28:24: ì„¸ì…˜ ìƒíƒœ í™•ì¸ ì™„ë£Œ
2024-11-17 20:28:24: AD ì‚¬ìš©ì ìƒì„± ëª…ë ¹ ì‹¤í–‰ ì‹œì‘
2024-11-17 20:28:25: ì›ê²© ì„¸ì…˜ ì¢…ë£Œ
2024-11-17 20:28:25: ì‚¬ìš©ì ìƒì„± ì™„ë£Œ: kms
Log initialization test: 11/17/2024 20:30:53
2024-11-17 20:30:53: ìŠ¤í¬ë¦½íŠ¸ ì‹œì‘ - ê²½ë¡œ: C:\Users\woods\development\HMProject\vdi_backend\src\main\resources\scripts
2024-11-17 20:30:53: ë¡œê·¸ ë””ë ‰í† ë¦¬: C:\Users\woods\development\HMProject\vdi_backend\src\main\resources\scripts\logs
2024-11-17 20:30:53: ì‹œì‘: AD ì‚¬ìš©ì ìƒì„± - UserID: kms, Name: ë¯¼ìˆ˜ ê¹€
2024-11-17 20:30:53: ì›ê²© ì—°ê²° ì„¤ì • ì‹œë„ - Server: 192.168.111.10, Username: administrator@hanbit.com
2024-11-17 20:30:53: ìê²© ì¦ëª… ìƒì„± ì„±ê³µ
2024-11-17 20:30:53: ì›ê²© ì„œë²„ ì—°ê²° í…ŒìŠ¤íŠ¸ ì‹œì‘
2024-11-17 20:30:53: ì›ê²© ì„œë²„ ì—°ê²° í…ŒìŠ¤íŠ¸ ì„±ê³µ
2024-11-17 20:30:53: ì›ê²© ì„¸ì…˜ ìƒì„± ì‹œë„
2024-11-17 20:30:54: ì›ê²© ì„¸ì…˜ ìƒì„± ì„±ê³µ (SessionId: 1)
2024-11-17 20:30:54: ì„¸ì…˜ ìƒíƒœ í™•ì¸ ì™„ë£Œ
2024-11-17 20:30:54: AD ì‚¬ìš©ì ìƒì„± ëª…ë ¹ ì‹¤í–‰ ì‹œì‘
2024-11-17 20:30:55: ì›ê²© ì„¸ì…˜ ì¢…ë£Œ
2024-11-17 20:30:55: ì‚¬ìš©ì ìƒì„± ì™„ë£Œ: kms
Log initialization test: 11/17/2024 20:31:26
2024-11-17 20:31:26: ìŠ¤í¬ë¦½íŠ¸ ì‹œì‘ - ê²½ë¡œ: C:\Users\woods\development\HMProject\vdi_backend\src\main\resources\scripts
2024-11-17 20:31:26: ë¡œê·¸ ë””ë ‰í† ë¦¬: C:\Users\woods\development\HMProject\vdi_backend\src\main\resources\scripts\logs
2024-11-17 20:31:26: ì‹œì‘: AD ì‚¬ìš©ì ìƒì„± - UserID: kms, Name: ë¯¼ìˆ˜ ê¹€
2024-11-17 20:31:26: ì›ê²© ì—°ê²° ì„¤ì • ì‹œë„ - Server: 192.168.111.10, Username: administrator@hanbit.com
2024-11-17 20:31:26: ìê²© ì¦ëª… ìƒì„± ì„±ê³µ
2024-11-17 20:31:26: ì›ê²© ì„œë²„ ì—°ê²° í…ŒìŠ¤íŠ¸ ì‹œì‘
2024-11-17 20:31:26: ì›ê²© ì„œë²„ ì—°ê²° í…ŒìŠ¤íŠ¸ ì„±ê³µ
2024-11-17 20:31:26: ì›ê²© ì„¸ì…˜ ìƒì„± ì‹œë„
2024-11-17 20:31:26: ì›ê²© ì„¸ì…˜ ìƒì„± ì„±ê³µ (SessionId: 1)
2024-11-17 20:31:26: ì„¸ì…˜ ìƒíƒœ í™•ì¸ ì™„ë£Œ
2024-11-17 20:31:26: AD ì‚¬ìš©ì ìƒì„± ëª…ë ¹ ì‹¤í–‰ ì‹œì‘
2024-11-17 20:31:27: ì›ê²© ì„¸ì…˜ ì¢…ë£Œ
2024-11-17 20:31:27: ì‚¬ìš©ì ìƒì„± ì™„ë£Œ: kms
Log initialization test: 11/17/2024 20:38:20
2024-11-17 20:38:20: ìŠ¤í¬ë¦½íŠ¸ ì‹œì‘ - ê²½ë¡œ: C:\Users\woods\development\HMProject\vdi_backend\src\main\resources\scripts
2024-11-17 20:38:20: ë¡œê·¸ ë””ë ‰í† ë¦¬: C:\Users\woods\development\HMProject\vdi_backend\src\main\resources\scripts\logs
2024-11-17 20:38:20: ì‹œì‘: AD ì‚¬ìš©ì ìƒì„± - UserID: kms, Name: ë¯¼ìˆ˜ ê¹€
2024-11-17 20:38:20: ì›ê²© ì—°ê²° ì„¤ì • ì‹œë„ - Server: 192.168.111.10, Username: administrator@hanbit.com
2024-11-17 20:38:20: ìê²© ì¦ëª… ìƒì„± ì„±ê³µ
2024-11-17 20:38:20: ì›ê²© ì„œë²„ ì—°ê²° í…ŒìŠ¤íŠ¸ ì‹œì‘
2024-11-17 20:38:20: ì›ê²© ì„œë²„ ì—°ê²° í…ŒìŠ¤íŠ¸ ì„±ê³µ
2024-11-17 20:38:20: ì›ê²© ì„¸ì…˜ ìƒì„± ì‹œë„
2024-11-17 20:38:20: ì›ê²© ì„¸ì…˜ ìƒì„± ì„±ê³µ (SessionId: 1)
2024-11-17 20:38:20: ì„¸ì…˜ ìƒíƒœ í™•ì¸ ì™„ë£Œ
2024-11-17 20:38:20: AD ì‚¬ìš©ì ìƒì„± ëª…ë ¹ ì‹¤í–‰ ì‹œì‘
2024-11-17 20:38:21: ì›ê²© ì„¸ì…˜ ì¢…ë£Œ
2024-11-17 20:38:21: ì‚¬ìš©ì ìƒì„± ì™„ë£Œ: kms
Log initialization test: 11/24/2024 18:50:11
2024-11-24 18:50:11: ìŠ¤í¬ë¦½íŠ¸ ì‹œì‘ - ê²½ë¡œ: C:\Users\woods\development\HMProject\vdi_backend\src\main\resources\scripts
2024-11-24 18:50:11: ë¡œê·¸ ë””ë ‰í† ë¦¬: C:\Users\woods\development\HMProject\vdi_backend\src\main\resources\scripts\logs
2024-11-24 18:50:11: ì‹œì‘: AD ì‚¬ìš©ì ìƒì„± - UserID: skb, Name: ê¸°ë²” ì„±
2024-11-24 18:50:11: ì›ê²© ì—°ê²° ì„¤ì • ì‹œë„ - Server: 192.168.111.10, Username: administrator@hanbit.com
2024-11-24 18:50:11: ìê²© ì¦ëª… ìƒì„± ì„±ê³µ
2024-11-24 18:50:11: ì›ê²© ì„œë²„ ì—°ê²° í…ŒìŠ¤íŠ¸ ì‹œì‘
2024-11-24 18:50:11: ì›ê²© ì„œë²„ ì—°ê²° í…ŒìŠ¤íŠ¸ ì„±ê³µ
2024-11-24 18:50:11: ì›ê²© ì„¸ì…˜ ìƒì„± ì‹œë„
2024-11-24 18:50:12: ì›ê²© ì„¸ì…˜ ìƒì„± ì„±ê³µ (SessionId: 1)
2024-11-24 18:50:12: ì„¸ì…˜ ìƒíƒœ í™•ì¸ ì™„ë£Œ
2024-11-24 18:50:12: AD ì‚¬ìš©ì ìƒì„± ëª…ë ¹ ì‹¤í–‰ ì‹œì‘
2024-11-24 18:50:15: ì›ê²© ì„¸ì…˜ ì¢…ë£Œ
2024-11-24 18:50:15: ì‚¬ìš©ì ìƒì„± ì™„ë£Œ: skb
Log initialization test: 11/24/2024 18:54:55
2024-11-24 18:54:55: ìŠ¤í¬ë¦½íŠ¸ ì‹œì‘ - ê²½ë¡œ: C:\Users\woods\development\HMProject\vdi_backend\src\main\resources\scripts
2024-11-24 18:54:55: ë¡œê·¸ ë””ë ‰í† ë¦¬: C:\Users\woods\development\HMProject\vdi_backend\src\main\resources\scripts\logs
2024-11-24 18:54:55: ì‹œì‘: AD ì‚¬ìš©ì ìƒì„± - UserID: skb, Name: ê¸°ë²” ì„±
2024-11-24 18:54:55: ì›ê²© ì—°ê²° ì„¤ì • ì‹œë„ - Server: 192.168.111.10, Username: administrator@hanbit.com
2024-11-24 18:54:55: ìê²© ì¦ëª… ìƒì„± ì„±ê³µ
2024-11-24 18:54:55: ì›ê²© ì„œë²„ ì—°ê²° í…ŒìŠ¤íŠ¸ ì‹œì‘
2024-11-24 18:54:55: ì›ê²© ì„œë²„ ì—°ê²° í…ŒìŠ¤íŠ¸ ì„±ê³µ
2024-11-24 18:54:55: ì›ê²© ì„¸ì…˜ ìƒì„± ì‹œë„
2024-11-24 18:54:56: ì›ê²© ì„¸ì…˜ ìƒì„± ì„±ê³µ (SessionId: 1)
2024-11-24 18:54:56: ì„¸ì…˜ ìƒíƒœ í™•ì¸ ì™„ë£Œ
2024-11-24 18:54:56: AD ì‚¬ìš©ì ìƒì„± ëª…ë ¹ ì‹¤í–‰ ì‹œì‘
2024-11-24 18:54:56: ì›ê²© ì„¸ì…˜ ì¢…ë£Œ
2024-11-24 18:54:56: ì‚¬ìš©ì ìƒì„± ì™„ë£Œ: skb
Log initialization test: 11/24/2024 19:01:12
2024-11-24 19:01:12: ìŠ¤í¬ë¦½íŠ¸ ì‹œì‘ - ê²½ë¡œ: C:\Users\woods\development\HMProject\vdi_backend\src\main\resources\scripts
2024-11-24 19:01:12: ë¡œê·¸ ë””ë ‰í† ë¦¬: C:\Users\woods\development\HMProject\vdi_backend\src\main\resources\scripts\logs
2024-11-24 19:01:12: ì‹œì‘: AD ì‚¬ìš©ì ìƒì„± - UserID: skb, Name: ê¸°ë²” ì„±
2024-11-24 19:01:12: ì›ê²© ì—°ê²° ì„¤ì • ì‹œë„ - Server: 192.168.111.10, Username: administrator@hanbit.com
2024-11-24 19:01:12: ìê²© ì¦ëª… ìƒì„± ì„±ê³µ
2024-11-24 19:01:12: ì›ê²© ì„œë²„ ì—°ê²° í…ŒìŠ¤íŠ¸ ì‹œì‘
2024-11-24 19:01:12: ì›ê²© ì„œë²„ ì—°ê²° í…ŒìŠ¤íŠ¸ ì„±ê³µ
2024-11-24 19:01:12: ì›ê²© ì„¸ì…˜ ìƒì„± ì‹œë„
2024-11-24 19:01:13: ì›ê²© ì„¸ì…˜ ìƒì„± ì„±ê³µ (SessionId: 1)
2024-11-24 19:01:13: ì„¸ì…˜ ìƒíƒœ í™•ì¸ ì™„ë£Œ
2024-11-24 19:01:13: AD ì‚¬ìš©ì ìƒì„± ëª…ë ¹ ì‹¤í–‰ ì‹œì‘
2024-11-24 19:01:15: ì›ê²© ì„¸ì…˜ ì¢…ë£Œ
2024-11-24 19:01:15: ì‚¬ìš©ì ìƒì„± ì™„ë£Œ: skb
Log initialization test: 11/24/2024 19:59:44
2024-11-24 19:59:44: ìŠ¤í¬ë¦½íŠ¸ ì‹œì‘ - ê²½ë¡œ: C:\Users\woods\development\HMProject\vdi_backend\src\main\resources\scripts
2024-11-24 19:59:44: ë¡œê·¸ ë””ë ‰í† ë¦¬: C:\Users\woods\development\HMProject\vdi_backend\src\main\resources\scripts\logs
2024-11-24 19:59:44: ì‹œì‘: AD ì‚¬ìš©ì ìƒì„± - UserID: skb, Name: ê¸°ë²” ì„±
2024-11-24 19:59:44: ì›ê²© ì—°ê²° ì„¤ì • ì‹œë„ - Server: 192.168.111.10, Username: administrator@hanbit.com
2024-11-24 19:59:44: ìê²© ì¦ëª… ìƒì„± ì„±ê³µ
2024-11-24 19:59:44: ì›ê²© ì„œë²„ ì—°ê²° í…ŒìŠ¤íŠ¸ ì‹œì‘
2024-11-24 19:59:45: ì›ê²© ì„œë²„ ì—°ê²° í…ŒìŠ¤íŠ¸ ì„±ê³µ
2024-11-24 19:59:45: ì›ê²© ì„¸ì…˜ ìƒì„± ì‹œë„
2024-11-24 19:59:45: ì›ê²© ì„¸ì…˜ ìƒì„± ì„±ê³µ (SessionId: 1)
2024-11-24 19:59:45: ì„¸ì…˜ ìƒíƒœ í™•ì¸ ì™„ë£Œ
2024-11-24 19:59:45: AD ì‚¬ìš©ì ìƒì„± ëª…ë ¹ ì‹¤í–‰ ì‹œì‘
2024-11-24 19:59:46: ì›ê²© ì„¸ì…˜ ì¢…ë£Œ
2024-11-24 19:59:46: ì‚¬ìš©ì ìƒì„± ì™„ë£Œ: skb
Log initialization test: 11/24/2024 20:06:25
2024-11-24 20:06:25: ìŠ¤í¬ë¦½íŠ¸ ì‹œì‘ - ê²½ë¡œ: C:\Users\woods\development\HMProject\vdi_backend\src\main\resources\scripts
2024-11-24 20:06:25: ë¡œê·¸ ë””ë ‰í† ë¦¬: C:\Users\woods\development\HMProject\vdi_backend\src\main\resources\scripts\logs
2024-11-24 20:06:25: ì‹œì‘: AD ì‚¬ìš©ì ìƒì„± - UserID: skb, Name: ê¸°ë²” ì„±
2024-11-24 20:06:25: ì›ê²© ì—°ê²° ì„¤ì • ì‹œë„ - Server: 192.168.111.10, Username: administrator@hanbit.com
2024-11-24 20:06:25: ìê²© ì¦ëª… ìƒì„± ì„±ê³µ
2024-11-24 20:06:25: ì›ê²© ì„œë²„ ì—°ê²° í…ŒìŠ¤íŠ¸ ì‹œì‘
2024-11-24 20:06:25: ì›ê²© ì„œë²„ ì—°ê²° í…ŒìŠ¤íŠ¸ ì„±ê³µ
2024-11-24 20:06:25: ì›ê²© ì„¸ì…˜ ìƒì„± ì‹œë„
2024-11-24 20:06:25: ì›ê²© ì„¸ì…˜ ìƒì„± ì„±ê³µ (SessionId: 1)
2024-11-24 20:06:25: ì„¸ì…˜ ìƒíƒœ í™•ì¸ ì™„ë£Œ
2024-11-24 20:06:25: AD ì‚¬ìš©ì ìƒì„± ëª…ë ¹ ì‹¤í–‰ ì‹œì‘
2024-11-24 20:06:26: ì›ê²© ì„¸ì…˜ ì¢…ë£Œ
2024-11-24 20:06:26: ì‚¬ìš©ì ìƒì„± ì™„ë£Œ: skb
Log initialization test: 11/24/2024 20:11:21
2024-11-24 20:11:21: ìŠ¤í¬ë¦½íŠ¸ ì‹œì‘ - ê²½ë¡œ: C:\Users\woods\development\HMProject\vdi_backend\src\main\resources\scripts
2024-11-24 20:11:21: ë¡œê·¸ ë””ë ‰í† ë¦¬: C:\Users\woods\development\HMProject\vdi_backend\src\main\resources\scripts\logs
2024-11-24 20:11:21: ì‹œì‘: AD ì‚¬ìš©ì ìƒì„± - UserID: skb, Name: ê¸°ë²” ì„±
2024-11-24 20:11:21: ì›ê²© ì—°ê²° ì„¤ì • ì‹œë„ - Server: 192.168.111.10, Username: administrator@hanbit.com
2024-11-24 20:11:21: ìê²© ì¦ëª… ìƒì„± ì„±ê³µ
2024-11-24 20:11:21: ì›ê²© ì„œë²„ ì—°ê²° í…ŒìŠ¤íŠ¸ ì‹œì‘
2024-11-24 20:11:21: ì›ê²© ì„œë²„ ì—°ê²° í…ŒìŠ¤íŠ¸ ì„±ê³µ
2024-11-24 20:11:21: ì›ê²© ì„¸ì…˜ ìƒì„± ì‹œë„
2024-11-24 20:11:21: ì›ê²© ì„¸ì…˜ ìƒì„± ì„±ê³µ (SessionId: 1)
2024-11-24 20:11:21: ì„¸ì…˜ ìƒíƒœ í™•ì¸ ì™„ë£Œ
2024-11-24 20:11:21: AD ì‚¬ìš©ì ìƒì„± ëª…ë ¹ ì‹¤í–‰ ì‹œì‘
2024-11-24 20:11:23: ì›ê²© ì„¸ì…˜ ì¢…ë£Œ
2024-11-24 20:11:23: ì‚¬ìš©ì ìƒì„± ì™„ë£Œ: skb
Log initialization test: 11/24/2024 20:20:08
2024-11-24 20:20:08: ìŠ¤í¬ë¦½íŠ¸ ì‹œì‘ - ê²½ë¡œ: C:\Users\woods\development\HMProject\vdi_backend\src\main\resources\scripts
2024-11-24 20:20:08: ë¡œê·¸ ë””ë ‰í† ë¦¬: C:\Users\woods\development\HMProject\vdi_backend\src\main\resources\scripts\logs
2024-11-24 20:20:08: ì‹œì‘: AD ì‚¬ìš©ì ìƒì„± - UserID: skb, Name: ê¸°ë²” ì„±
2024-11-24 20:20:08: ì›ê²© ì—°ê²° ì„¤ì • ì‹œë„ - Server: 192.168.111.10, Username: administrator@hanbit.com
2024-11-24 20:20:08: ìê²© ì¦ëª… ìƒì„± ì„±ê³µ
2024-11-24 20:20:08: ì›ê²© ì„œë²„ ì—°ê²° í…ŒìŠ¤íŠ¸ ì‹œì‘
2024-11-24 20:20:09: ì›ê²© ì„œë²„ ì—°ê²° í…ŒìŠ¤íŠ¸ ì„±ê³µ
2024-11-24 20:20:09: ì›ê²© ì„¸ì…˜ ìƒì„± ì‹œë„
2024-11-24 20:20:09: ì›ê²© ì„¸ì…˜ ìƒì„± ì„±ê³µ (SessionId: 1)
2024-11-24 20:20:09: ì„¸ì…˜ ìƒíƒœ í™•ì¸ ì™„ë£Œ
2024-11-24 20:20:09: AD ì‚¬ìš©ì ìƒì„± ëª…ë ¹ ì‹¤í–‰ ì‹œì‘
2024-11-24 20:20:10: ì›ê²© ì„¸ì…˜ ì¢…ë£Œ
2024-11-24 20:20:10: ì‚¬ìš©ì ìƒì„± ì™„ë£Œ: skb
Log initialization test: 11/24/2024 20:27:14
2024-11-24 20:27:14: ìŠ¤í¬ë¦½íŠ¸ ì‹œì‘ - ê²½ë¡œ: C:\Users\woods\development\HMProject\vdi_backend\src\main\resources\scripts
2024-11-24 20:27:14: ë¡œê·¸ ë””ë ‰í† ë¦¬: C:\Users\woods\development\HMProject\vdi_backend\src\main\resources\scripts\logs
2024-11-24 20:27:14: ì‹œì‘: AD ì‚¬ìš©ì ìƒì„± - UserID: skb, Name: ê¸°ë²” ì„±
2024-11-24 20:27:14: ì›ê²© ì—°ê²° ì„¤ì • ì‹œë„ - Server: 192.168.111.10, Username: administrator@hanbit.com
2024-11-24 20:27:14: ìê²© ì¦ëª… ìƒì„± ì„±ê³µ
2024-11-24 20:27:15: ì›ê²© ì„œë²„ ì—°ê²° í…ŒìŠ¤íŠ¸ ì‹œì‘
2024-11-24 20:27:15: ì›ê²© ì„œë²„ ì—°ê²° í…ŒìŠ¤íŠ¸ ì„±ê³µ
2024-11-24 20:27:15: ì›ê²© ì„¸ì…˜ ìƒì„± ì‹œë„
2024-11-24 20:27:15: ì›ê²© ì„¸ì…˜ ìƒì„± ì„±ê³µ (SessionId: 1)
2024-11-24 20:27:15: ì„¸ì…˜ ìƒíƒœ í™•ì¸ ì™„ë£Œ
2024-11-24 20:27:15: AD ì‚¬ìš©ì ìƒì„± ëª…ë ¹ ì‹¤í–‰ ì‹œì‘
2024-11-24 20:27:16: ì›ê²© ì„¸ì…˜ ì¢…ë£Œ
2024-11-24 20:27:16: ì‚¬ìš©ì ìƒì„± ì™„ë£Œ: skb
Log initialization test: 11/24/2024 20:46:17
2024-11-24 20:46:17: ìŠ¤í¬ë¦½íŠ¸ ì‹œì‘ - ê²½ë¡œ: C:\Users\woods\development\HMProject\vdi_backend\src\main\resources\scripts
2024-11-24 20:46:17: ë¡œê·¸ ë””ë ‰í† ë¦¬: C:\Users\woods\development\HMProject\vdi_backend\src\main\resources\scripts\logs
2024-11-24 20:46:17: ì‹œì‘: AD ì‚¬ìš©ì ìƒì„± - UserID: skb, Name: ê¸°ë²” ì„±
2024-11-24 20:46:17: ì›ê²© ì—°ê²° ì„¤ì • ì‹œë„ - Server: 192.168.111.10, Username: administrator@hanbit.com
2024-11-24 20:46:17: ìê²© ì¦ëª… ìƒì„± ì„±ê³µ
2024-11-24 20:46:17: ì›ê²© ì„œë²„ ì—°ê²° í…ŒìŠ¤íŠ¸ ì‹œì‘
2024-11-24 20:46:18: ì›ê²© ì„œë²„ ì—°ê²° í…ŒìŠ¤íŠ¸ ì„±ê³µ
2024-11-24 20:46:18: ì›ê²© ì„¸ì…˜ ìƒì„± ì‹œë„
2024-11-24 20:46:18: ì›ê²© ì„¸ì…˜ ìƒì„± ì„±ê³µ (SessionId: 1)
2024-11-24 20:46:18: ì„¸ì…˜ ìƒíƒœ í™•ì¸ ì™„ë£Œ
2024-11-24 20:46:18: AD ì‚¬ìš©ì ìƒì„± ëª…ë ¹ ì‹¤í–‰ ì‹œì‘
2024-11-24 20:46:19: ì›ê²© ì„¸ì…˜ ì¢…ë£Œ
2024-11-24 20:46:19: ì‚¬ìš©ì ìƒì„± ì™„ë£Œ: skb
Log initialization test: 11/24/2024 20:55:12
2024-11-24 20:55:12: ìŠ¤í¬ë¦½íŠ¸ ì‹œì‘ - ê²½ë¡œ: C:\Users\woods\development\HMProject\vdi_backend\src\main\resources\scripts
2024-11-24 20:55:12: ë¡œê·¸ ë””ë ‰í† ë¦¬: C:\Users\woods\development\HMProject\vdi_backend\src\main\resources\scripts\logs
2024-11-24 20:55:12: ì‹œì‘: AD ì‚¬ìš©ì ìƒì„± - UserID: skb, Name: ê¸°ë²” ì„±
2024-11-24 20:55:12: ì›ê²© ì—°ê²° ì„¤ì • ì‹œë„ - Server: 192.168.111.10, Username: administrator@hanbit.com
2024-11-24 20:55:12: ìê²© ì¦ëª… ìƒì„± ì„±ê³µ
2024-11-24 20:55:12: ì›ê²© ì„œë²„ ì—°ê²° í…ŒìŠ¤íŠ¸ ì‹œì‘
2024-11-24 20:55:12: ì›ê²© ì„œë²„ ì—°ê²° í…ŒìŠ¤íŠ¸ ì„±ê³µ
2024-11-24 20:55:12: ì›ê²© ì„¸ì…˜ ìƒì„± ì‹œë„
2024-11-24 20:55:12: ì›ê²© ì„¸ì…˜ ìƒì„± ì„±ê³µ (SessionId: 1)
2024-11-24 20:55:12: ì„¸ì…˜ ìƒíƒœ í™•ì¸ ì™„ë£Œ
2024-11-24 20:55:12: AD ì‚¬ìš©ì ìƒì„± ëª…ë ¹ ì‹¤í–‰ ì‹œì‘
2024-11-24 20:55:13: ì›ê²© ì„¸ì…˜ ì¢…ë£Œ
2024-11-24 20:55:13: ì‚¬ìš©ì ìƒì„± ì™„ë£Œ: skb
Log initialization test: 11/24/2024 21:01:11
2024-11-24 21:01:11: ìŠ¤í¬ë¦½íŠ¸ ì‹œì‘ - ê²½ë¡œ: C:\Users\woods\development\HMProject\vdi_backend\src\main\resources\scripts
2024-11-24 21:01:11: ë¡œê·¸ ë””ë ‰í† ë¦¬: C:\Users\woods\development\HMProject\vdi_backend\src\main\resources\scripts\logs
2024-11-24 21:01:11: ì‹œì‘: AD ì‚¬ìš©ì ìƒì„± - UserID: skb, Name: ê¸°ë²” ì„±
2024-11-24 21:01:11: ì›ê²© ì—°ê²° ì„¤ì • ì‹œë„ - Server: 192.168.111.10, Username: administrator@hanbit.com
2024-11-24 21:01:11: ìê²© ì¦ëª… ìƒì„± ì„±ê³µ
2024-11-24 21:01:11: ì›ê²© ì„œë²„ ì—°ê²° í…ŒìŠ¤íŠ¸ ì‹œì‘
2024-11-24 21:01:11: ì›ê²© ì„œë²„ ì—°ê²° í…ŒìŠ¤íŠ¸ ì„±ê³µ
2024-11-24 21:01:11: ì›ê²© ì„¸ì…˜ ìƒì„± ì‹œë„
2024-11-24 21:01:11: ì›ê²© ì„¸ì…˜ ìƒì„± ì„±ê³µ (SessionId: 1)
2024-11-24 21:01:11: ì„¸ì…˜ ìƒíƒœ í™•ì¸ ì™„ë£Œ
2024-11-24 21:01:11: AD ì‚¬ìš©ì ìƒì„± ëª…ë ¹ ì‹¤í–‰ ì‹œì‘
2024-11-24 21:01:13: ì›ê²© ì„¸ì…˜ ì¢…ë£Œ
2024-11-24 21:01:13: ì‚¬ìš©ì ìƒì„± ì™„ë£Œ: skb
Log initialization test: 11/24/2024 21:02:12
2024-11-24 21:02:12: ìŠ¤í¬ë¦½íŠ¸ ì‹œì‘ - ê²½ë¡œ: C:\Users\woods\development\HMProject\vdi_backend\src\main\resources\scripts
2024-11-24 21:02:12: ë¡œê·¸ ë””ë ‰í† ë¦¬: C:\Users\woods\development\HMProject\vdi_backend\src\main\resources\scripts\logs
2024-11-24 21:02:12: ì‹œì‘: AD ì‚¬ìš©ì ìƒì„± - UserID: skb, Name: ê¸°ë²” ì„±
2024-11-24 21:02:12: ì›ê²© ì—°ê²° ì„¤ì • ì‹œë„ - Server: 192.168.111.10, Username: administrator@hanbit.com
2024-11-24 21:02:12: ìê²© ì¦ëª… ìƒì„± ì„±ê³µ
2024-11-24 21:02:12: ì›ê²© ì„œë²„ ì—°ê²° í…ŒìŠ¤íŠ¸ ì‹œì‘
2024-11-24 21:02:12: ì›ê²© ì„œë²„ ì—°ê²° í…ŒìŠ¤íŠ¸ ì„±ê³µ
2024-11-24 21:02:12: ì›ê²© ì„¸ì…˜ ìƒì„± ì‹œë„
2024-11-24 21:02:12: ì›ê²© ì„¸ì…˜ ìƒì„± ì„±ê³µ (SessionId: 1)
2024-11-24 21:02:12: ì„¸ì…˜ ìƒíƒœ í™•ì¸ ì™„ë£Œ
2024-11-24 21:02:12: AD ì‚¬ìš©ì ìƒì„± ëª…ë ¹ ì‹¤í–‰ ì‹œì‘
2024-11-24 21:02:13: ì›ê²© ì„¸ì…˜ ì¢…ë£Œ
2024-11-24 21:02:13: ì‚¬ìš©ì ìƒì„± ì™„ë£Œ: skb
Log initialization test: 11/24/2024 21:04:30
2024-11-24 21:04:30: ìŠ¤í¬ë¦½íŠ¸ ì‹œì‘ - ê²½ë¡œ: C:\Users\woods\development\HMProject\vdi_backend\src\main\resources\scripts
2024-11-24 21:04:30: ë¡œê·¸ ë””ë ‰í† ë¦¬: C:\Users\woods\development\HMProject\vdi_backend\src\main\resources\scripts\logs
2024-11-24 21:04:30: ì‹œì‘: AD ì‚¬ìš©ì ìƒì„± - UserID: skb, Name: ê¸°ë²” ì„±
2024-11-24 21:04:30: ì›ê²© ì—°ê²° ì„¤ì • ì‹œë„ - Server: 192.168.111.10, Username: administrator@hanbit.com
2024-11-24 21:04:30: ìê²© ì¦ëª… ìƒì„± ì„±ê³µ
2024-11-24 21:04:30: ì›ê²© ì„œë²„ ì—°ê²° í…ŒìŠ¤íŠ¸ ì‹œì‘
2024-11-24 21:04:30: ì›ê²© ì„œë²„ ì—°ê²° í…ŒìŠ¤íŠ¸ ì„±ê³µ
2024-11-24 21:04:30: ì›ê²© ì„¸ì…˜ ìƒì„± ì‹œë„
2024-11-24 21:04:30: ì›ê²© ì„¸ì…˜ ìƒì„± ì„±ê³µ (SessionId: 1)
2024-11-24 21:04:30: ì„¸ì…˜ ìƒíƒœ í™•ì¸ ì™„ë£Œ
2024-11-24 21:04:30: AD ì‚¬ìš©ì ìƒì„± ëª…ë ¹ ì‹¤í–‰ ì‹œì‘
2024-11-24 21:04:32: ì›ê²© ì„¸ì…˜ ì¢…ë£Œ
2024-11-24 21:04:32: ì‚¬ìš©ì ìƒì„± ì™„ë£Œ: skb
Log initialization test: 11/24/2024 21:07:29
2024-11-24 21:07:29: ìŠ¤í¬ë¦½íŠ¸ ì‹œì‘ - ê²½ë¡œ: C:\Users\woods\development\HMProject\vdi_backend\src\main\resources\scripts
2024-11-24 21:07:29: ë¡œê·¸ ë””ë ‰í† ë¦¬: C:\Users\woods\development\HMProject\vdi_backend\src\main\resources\scripts\logs
2024-11-24 21:07:29: ì‹œì‘: AD ì‚¬ìš©ì ìƒì„± - UserID: skb, Name: ê¸°ë²” ì„±
2024-11-24 21:07:29: ì›ê²© ì—°ê²° ì„¤ì • ì‹œë„ - Server: 192.168.111.10, Username: administrator@hanbit.com
2024-11-24 21:07:29: ìê²© ì¦ëª… ìƒì„± ì„±ê³µ
2024-11-24 21:07:29: ì›ê²© ì„œë²„ ì—°ê²° í…ŒìŠ¤íŠ¸ ì‹œì‘
2024-11-24 21:07:29: ì›ê²© ì„œë²„ ì—°ê²° í…ŒìŠ¤íŠ¸ ì„±ê³µ
2024-11-24 21:07:29: ì›ê²© ì„¸ì…˜ ìƒì„± ì‹œë„
2024-11-24 21:07:30: ì›ê²© ì„¸ì…˜ ìƒì„± ì„±ê³µ (SessionId: 1)
2024-11-24 21:07:30: ì„¸ì…˜ ìƒíƒœ í™•ì¸ ì™„ë£Œ
2024-11-24 21:07:30: AD ì‚¬ìš©ì ìƒì„± ëª…ë ¹ ì‹¤í–‰ ì‹œì‘
2024-11-24 21:07:30: ì›ê²© ì„¸ì…˜ ì¢…ë£Œ
2024-11-24 21:07:30: ì‚¬ìš©ì ìƒì„± ì™„ë£Œ: skb
Log initialization test: 11/24/2024 21:35:11
2024-11-24 21:35:11: ìŠ¤í¬ë¦½íŠ¸ ì‹œì‘ - ê²½ë¡œ: C:\Users\woods\development\HMProject\vdi_backend\src\main\resources\scripts
2024-11-24 21:35:11: ë¡œê·¸ ë””ë ‰í† ë¦¬: C:\Users\woods\development\HMProject\vdi_backend\src\main\resources\scripts\logs
2024-11-24 21:35:11: ì‹œì‘: AD ì‚¬ìš©ì ìƒì„± - UserID: skb, Name: ê¸°ë²” ì„±
2024-11-24 21:35:11: ì›ê²© ì—°ê²° ì„¤ì • ì‹œë„ - Server: 192.168.111.10, Username: administrator@hanbit.com
2024-11-24 21:35:11: ìê²© ì¦ëª… ìƒì„± ì„±ê³µ
2024-11-24 21:35:11: ì›ê²© ì„œë²„ ì—°ê²° í…ŒìŠ¤íŠ¸ ì‹œì‘
2024-11-24 21:35:11: ì›ê²© ì„œë²„ ì—°ê²° í…ŒìŠ¤íŠ¸ ì„±ê³µ
2024-11-24 21:35:11: ì›ê²© ì„¸ì…˜ ìƒì„± ì‹œë„
2024-11-24 21:35:12: ì›ê²© ì„¸ì…˜ ìƒì„± ì„±ê³µ (SessionId: 1)
2024-11-24 21:35:12: ì„¸ì…˜ ìƒíƒœ í™•ì¸ ì™„ë£Œ
2024-11-24 21:35:12: AD ì‚¬ìš©ì ìƒì„± ëª…ë ¹ ì‹¤í–‰ ì‹œì‘
2024-11-24 21:35:13: ì›ê²© ì„¸ì…˜ ì¢…ë£Œ
2024-11-24 21:35:13: ì‚¬ìš©ì ìƒì„± ì™„ë£Œ: skb
Log initialization test: 11/24/2024 21:42:33
2024-11-24 21:42:33: ìŠ¤í¬ë¦½íŠ¸ ì‹œì‘ - ê²½ë¡œ: C:\Users\woods\development\HMProject\vdi_backend\src\main\resources\scripts
2024-11-24 21:42:33: ë¡œê·¸ ë””ë ‰í† ë¦¬: C:\Users\woods\development\HMProject\vdi_backend\src\main\resources\scripts\logs
2024-11-24 21:42:33: ì‹œì‘: AD ì‚¬ìš©ì ìƒì„± - UserID: skb, Name: ê¸°ë²” ì„±
2024-11-24 21:42:33: ì›ê²© ì—°ê²° ì„¤ì • ì‹œë„ - Server: 192.168.111.10, Username: administrator@hanbit.com
2024-11-24 21:42:33: ìê²© ì¦ëª… ìƒì„± ì„±ê³µ
2024-11-24 21:42:33: ì›ê²© ì„œë²„ ì—°ê²° í…ŒìŠ¤íŠ¸ ì‹œì‘
2024-11-24 21:42:33: ì›ê²© ì„œë²„ ì—°ê²° í…ŒìŠ¤íŠ¸ ì„±ê³µ
2024-11-24 21:42:33: ì›ê²© ì„¸ì…˜ ìƒì„± ì‹œë„
2024-11-24 21:42:34: ì›ê²© ì„¸ì…˜ ìƒì„± ì„±ê³µ (SessionId: 1)
2024-11-24 21:42:34: ì„¸ì…˜ ìƒíƒœ í™•ì¸ ì™„ë£Œ
2024-11-24 21:42:34: AD ì‚¬ìš©ì ìƒì„± ëª…ë ¹ ì‹¤í–‰ ì‹œì‘
2024-11-24 21:42:35: ì›ê²© ì„¸ì…˜ ì¢…ë£Œ
2024-11-24 21:42:35: ì‚¬ìš©ì ìƒì„± ì™„ë£Œ: skb
Log initialization test: 11/25/2024 21:37:50
2024-11-25 21:37:50: ìŠ¤í¬ë¦½íŠ¸ ì‹œì‘ - ê²½ë¡œ: C:\Users\woods\development\HMProject\vdi_backend\src\main\resources\scripts
2024-11-25 21:37:50: ë¡œê·¸ ë””ë ‰í† ë¦¬: C:\Users\woods\development\HMProject\vdi_backend\src\main\resources\scripts\logs
2024-11-25 21:37:50: ì‹œì‘: AD ì‚¬ìš©ì ìƒì„± - UserID: skb, Name: ê¸°ë²” ì„±
2024-11-25 21:37:50: ì›ê²© ì—°ê²° ì„¤ì • ì‹œë„ - Server: 192.168.111.10, Username: administrator@hanbit.com
2024-11-25 21:37:50: ìê²© ì¦ëª… ìƒì„± ì„±ê³µ
2024-11-25 21:37:50: ì›ê²© ì„œë²„ ì—°ê²° í…ŒìŠ¤íŠ¸ ì‹œì‘
2024-11-25 21:37:50: ì›ê²© ì„œë²„ ì—°ê²° í…ŒìŠ¤íŠ¸ ì„±ê³µ
2024-11-25 21:37:50: ì›ê²© ì„¸ì…˜ ìƒì„± ì‹œë„
2024-11-25 21:37:50: ì›ê²© ì„¸ì…˜ ìƒì„± ì„±ê³µ (SessionId: 1)
2024-11-25 21:37:50: ì„¸ì…˜ ìƒíƒœ í™•ì¸ ì™„ë£Œ
2024-11-25 21:37:50: AD ì‚¬ìš©ì ìƒì„± ëª…ë ¹ ì‹¤í–‰ ì‹œì‘
2024-11-25 21:37:52: ì›ê²© ì„¸ì…˜ ì¢…ë£Œ
2024-11-25 21:37:52: ì‚¬ìš©ì ìƒì„± ì™„ë£Œ: skb
Log initialization test: 11/25/2024 21:40:48
2024-11-25 21:40:48: ìŠ¤í¬ë¦½íŠ¸ ì‹œì‘ - ê²½ë¡œ: C:\Users\woods\development\HMProject\vdi_backend\src\main\resources\scripts
2024-11-25 21:40:48: ë¡œê·¸ ë””ë ‰í† ë¦¬: C:\Users\woods\development\HMProject\vdi_backend\src\main\resources\scripts\logs
2024-11-25 21:40:48: ì‹œì‘: AD ì‚¬ìš©ì ìƒì„± - UserID: skb, Name: ê¸°ë²” ì„±
2024-11-25 21:40:48: ì›ê²© ì—°ê²° ì„¤ì • ì‹œë„ - Server: 192.168.111.10, Username: administrator@hanbit.com
2024-11-25 21:40:48: ìê²© ì¦ëª… ìƒì„± ì„±ê³µ
2024-11-25 21:40:48: ì›ê²© ì„œë²„ ì—°ê²° í…ŒìŠ¤íŠ¸ ì‹œì‘
2024-11-25 21:40:48: ì›ê²© ì„œë²„ ì—°ê²° í…ŒìŠ¤íŠ¸ ì„±ê³µ
2024-11-25 21:40:48: ì›ê²© ì„¸ì…˜ ìƒì„± ì‹œë„
2024-11-25 21:40:48: ì›ê²© ì„¸ì…˜ ìƒì„± ì„±ê³µ (SessionId: 1)
2024-11-25 21:40:48: ì„¸ì…˜ ìƒíƒœ í™•ì¸ ì™„ë£Œ
2024-11-25 21:40:48: AD ì‚¬ìš©ì ìƒì„± ëª…ë ¹ ì‹¤í–‰ ì‹œì‘
2024-11-25 21:40:49: ì›ê²© ì„¸ì…˜ ì¢…ë£Œ
2024-11-25 21:40:49: ì‚¬ìš©ì ìƒì„± ì™„ë£Œ: skb
Log initialization test: 11/25/2024 21:44:28
2024-11-25 21:44:28: ìŠ¤í¬ë¦½íŠ¸ ì‹œì‘ - ê²½ë¡œ: C:\Users\woods\development\HMProject\vdi_backend\src\main\resources\scripts
2024-11-25 21:44:28: ë¡œê·¸ ë””ë ‰í† ë¦¬: C:\Users\woods\development\HMProject\vdi_backend\src\main\resources\scripts\logs
2024-11-25 21:44:28: ì‹œì‘: AD ì‚¬ìš©ì ìƒì„± - UserID: skb, Name: ê¸°ë²” ì„±
2024-11-25 21:44:28: ì›ê²© ì—°ê²° ì„¤ì • ì‹œë„ - Server: 192.168.111.10, Username: administrator@hanbit.com
2024-11-25 21:44:28: ìê²© ì¦ëª… ìƒì„± ì„±ê³µ
2024-11-25 21:44:28: ì›ê²© ì„œë²„ ì—°ê²° í…ŒìŠ¤íŠ¸ ì‹œì‘
2024-11-25 21:44:28: ì›ê²© ì„œë²„ ì—°ê²° í…ŒìŠ¤íŠ¸ ì„±ê³µ
2024-11-25 21:44:28: ì›ê²© ì„¸ì…˜ ìƒì„± ì‹œë„
2024-11-25 21:44:28: ì›ê²© ì„¸ì…˜ ìƒì„± ì„±ê³µ (SessionId: 1)
2024-11-25 21:44:28: ì„¸ì…˜ ìƒíƒœ í™•ì¸ ì™„ë£Œ
2024-11-25 21:44:28: AD ì‚¬ìš©ì ìƒì„± ëª…ë ¹ ì‹¤í–‰ ì‹œì‘
2024-11-25 21:44:29: ì›ê²© ì„¸ì…˜ ì¢…ë£Œ
2024-11-25 21:44:29: ì‚¬ìš©ì ìƒì„± ì™„ë£Œ: skb
Log initialization test: 11/25/2024 21:47:04
2024-11-25 21:47:04: ìŠ¤í¬ë¦½íŠ¸ ì‹œì‘ - ê²½ë¡œ: C:\Users\woods\development\HMProject\vdi_backend\src\main\resources\scripts
2024-11-25 21:47:04: ë¡œê·¸ ë””ë ‰í† ë¦¬: C:\Users\woods\development\HMProject\vdi_backend\src\main\resources\scripts\logs
2024-11-25 21:47:04: ì‹œì‘: AD ì‚¬ìš©ì ìƒì„± - UserID: skb, Name: ê¸°ë²” ì„±
2024-11-25 21:47:04: ì›ê²© ì—°ê²° ì„¤ì • ì‹œë„ - Server: 192.168.111.10, Username: administrator@hanbit.com
2024-11-25 21:47:04: ìê²© ì¦ëª… ìƒì„± ì„±ê³µ
2024-11-25 21:47:04: ì›ê²© ì„œë²„ ì—°ê²° í…ŒìŠ¤íŠ¸ ì‹œì‘
2024-11-25 21:47:04: ì›ê²© ì„œë²„ ì—°ê²° í…ŒìŠ¤íŠ¸ ì„±ê³µ
2024-11-25 21:47:04: ì›ê²© ì„¸ì…˜ ìƒì„± ì‹œë„
2024-11-25 21:47:05: ì›ê²© ì„¸ì…˜ ìƒì„± ì„±ê³µ (SessionId: 1)
2024-11-25 21:47:05: ì„¸ì…˜ ìƒíƒœ í™•ì¸ ì™„ë£Œ
2024-11-25 21:47:05: AD ì‚¬ìš©ì ìƒì„± ëª…ë ¹ ì‹¤í–‰ ì‹œì‘
2024-11-25 21:47:05: ì›ê²© ì„¸ì…˜ ì¢…ë£Œ
2024-11-25 21:47:05: ì‚¬ìš©ì ìƒì„± ì™„ë£Œ: skb
Log initialization test: 11/25/2024 21:51:39
2024-11-25 21:51:39: ìŠ¤í¬ë¦½íŠ¸ ì‹œì‘ - ê²½ë¡œ: C:\Users\woods\development\HMProject\vdi_backend\src\main\resources\scripts
2024-11-25 21:51:39: ë¡œê·¸ ë””ë ‰í† ë¦¬: C:\Users\woods\development\HMProject\vdi_backend\src\main\resources\scripts\logs
2024-11-25 21:51:39: ì‹œì‘: AD ì‚¬ìš©ì ìƒì„± - UserID: skb, Name: ê¸°ë²” ì„±
2024-11-25 21:51:39: ì›ê²© ì—°ê²° ì„¤ì • ì‹œë„ - Server: 192.168.111.10, Username: administrator@hanbit.com
2024-11-25 21:51:39: ìê²© ì¦ëª… ìƒì„± ì„±ê³µ
2024-11-25 21:51:39: ì›ê²© ì„œë²„ ì—°ê²° í…ŒìŠ¤íŠ¸ ì‹œì‘
2024-11-25 21:51:39: ì›ê²© ì„œë²„ ì—°ê²° í…ŒìŠ¤íŠ¸ ì„±ê³µ
2024-11-25 21:51:39: ì›ê²© ì„¸ì…˜ ìƒì„± ì‹œë„
2024-11-25 21:51:39: ì›ê²© ì„¸ì…˜ ìƒì„± ì„±ê³µ (SessionId: 1)
2024-11-25 21:51:39: ì„¸ì…˜ ìƒíƒœ í™•ì¸ ì™„ë£Œ
2024-11-25 21:51:39: AD ì‚¬ìš©ì ìƒì„± ëª…ë ¹ ì‹¤í–‰ ì‹œì‘
2024-11-25 21:51:40: ì›ê²© ì„¸ì…˜ ì¢…ë£Œ
2024-11-25 21:51:40: ì‚¬ìš©ì ìƒì„± ì™„ë£Œ: skb
Log initialization test: 11/25/2024 22:13:22
2024-11-25 22:13:22: ìŠ¤í¬ë¦½íŠ¸ ì‹œì‘ - ê²½ë¡œ: C:\Users\woods\development\HMProject\vdi_backend\src\main\resources\scripts
2024-11-25 22:13:22: ë¡œê·¸ ë””ë ‰í† ë¦¬: C:\Users\woods\development\HMProject\vdi_backend\src\main\resources\scripts\logs
2024-11-25 22:13:22: ì‹œì‘: AD ì‚¬ìš©ì ìƒì„± - UserID: skb, Name: ê¸°ë²” ì„±
2024-11-25 22:13:22: ì›ê²© ì—°ê²° ì„¤ì • ì‹œë„ - Server: 192.168.111.10, Username: administrator@hanbit.com
2024-11-25 22:13:22: ìê²© ì¦ëª… ìƒì„± ì„±ê³µ
2024-11-25 22:13:22: ì›ê²© ì„œë²„ ì—°ê²° í…ŒìŠ¤íŠ¸ ì‹œì‘
2024-11-25 22:13:22: ì›ê²© ì„œë²„ ì—°ê²° í…ŒìŠ¤íŠ¸ ì„±ê³µ
2024-11-25 22:13:22: ì›ê²© ì„¸ì…˜ ìƒì„± ì‹œë„
2024-11-25 22:13:22: ì›ê²© ì„¸ì…˜ ìƒì„± ì„±ê³µ (SessionId: 1)
2024-11-25 22:13:22: ì„¸ì…˜ ìƒíƒœ í™•ì¸ ì™„ë£Œ
2024-11-25 22:13:22: AD ì‚¬ìš©ì ìƒì„± ëª…ë ¹ ì‹¤í–‰ ì‹œì‘
2024-11-25 22:13:23: ì›ê²© ì„¸ì…˜ ì¢…ë£Œ
2024-11-25 22:13:23: ì‚¬ìš©ì ìƒì„± ì™„ë£Œ: skb
Log initialization test: 11/25/2024 22:16:07
2024-11-25 22:16:07: ìŠ¤í¬ë¦½íŠ¸ ì‹œì‘ - ê²½ë¡œ: C:\Users\woods\development\HMProject\vdi_backend\src\main\resources\scripts
2024-11-25 22:16:07: ë¡œê·¸ ë””ë ‰í† ë¦¬: C:\Users\woods\development\HMProject\vdi_backend\src\main\resources\scripts\logs
2024-11-25 22:16:07: ì‹œì‘: AD ì‚¬ìš©ì ìƒì„± - UserID: skb, Name: ê¸°ë²” ì„±
2024-11-25 22:16:07: ì›ê²© ì—°ê²° ì„¤ì • ì‹œë„ - Server: 192.168.111.10, Username: administrator@hanbit.com
2024-11-25 22:16:07: ìê²© ì¦ëª… ìƒì„± ì„±ê³µ
2024-11-25 22:16:07: ì›ê²© ì„œë²„ ì—°ê²° í…ŒìŠ¤íŠ¸ ì‹œì‘
2024-11-25 22:16:07: ì›ê²© ì„œë²„ ì—°ê²° í…ŒìŠ¤íŠ¸ ì„±ê³µ
2024-11-25 22:16:07: ì›ê²© ì„¸ì…˜ ìƒì„± ì‹œë„
2024-11-25 22:16:07: ì›ê²© ì„¸ì…˜ ìƒì„± ì„±ê³µ (SessionId: 1)
2024-11-25 22:16:07: ì„¸ì…˜ ìƒíƒœ í™•ì¸ ì™„ë£Œ
2024-11-25 22:16:07: AD ì‚¬ìš©ì ìƒì„± ëª…ë ¹ ì‹¤í–‰ ì‹œì‘
2024-11-25 22:16:08: ì›ê²© ì„¸ì…˜ ì¢…ë£Œ
2024-11-25 22:16:08: ì‚¬ìš©ì ìƒì„± ì™„ë£Œ: skb
Log initialization test: 11/25/2024 22:18:31
2024-11-25 22:18:31: ìŠ¤í¬ë¦½íŠ¸ ì‹œì‘ - ê²½ë¡œ: C:\Users\woods\development\HMProject\vdi_backend\src\main\resources\scripts
2024-11-25 22:18:31: ë¡œê·¸ ë””ë ‰í† ë¦¬: C:\Users\woods\development\HMProject\vdi_backend\src\main\resources\scripts\logs
2024-11-25 22:18:31: ì‹œì‘: AD ì‚¬ìš©ì ìƒì„± - UserID: skb, Name: ê¸°ë²” ì„±
2024-11-25 22:18:31: ì›ê²© ì—°ê²° ì„¤ì • ì‹œë„ - Server: 192.168.111.10, Username: administrator@hanbit.com
2024-11-25 22:18:31: ìê²© ì¦ëª… ìƒì„± ì„±ê³µ
2024-11-25 22:18:31: ì›ê²© ì„œë²„ ì—°ê²° í…ŒìŠ¤íŠ¸ ì‹œì‘
2024-11-25 22:18:31: ì›ê²© ì„œë²„ ì—°ê²° í…ŒìŠ¤íŠ¸ ì„±ê³µ
2024-11-25 22:18:31: ì›ê²© ì„¸ì…˜ ìƒì„± ì‹œë„
2024-11-25 22:18:31: ì›ê²© ì„¸ì…˜ ìƒì„± ì„±ê³µ (SessionId: 1)
2024-11-25 22:18:31: ì„¸ì…˜ ìƒíƒœ í™•ì¸ ì™„ë£Œ
2024-11-25 22:18:31: AD ì‚¬ìš©ì ìƒì„± ëª…ë ¹ ì‹¤í–‰ ì‹œì‘
2024-11-25 22:18:32: ì›ê²© ì„¸ì…˜ ì¢…ë£Œ
2024-11-25 22:18:32: ì‚¬ìš©ì ìƒì„± ì™„ë£Œ: skb
Log initialization test: 11/25/2024 22:21:53
2024-11-25 22:21:53: ìŠ¤í¬ë¦½íŠ¸ ì‹œì‘ - ê²½ë¡œ: C:\Users\woods\development\HMProject\vdi_backend\src\main\resources\scripts
2024-11-25 22:21:53: ë¡œê·¸ ë””ë ‰í† ë¦¬: C:\Users\woods\development\HMProject\vdi_backend\src\main\resources\scripts\logs
2024-11-25 22:21:53: ì‹œì‘: AD ì‚¬ìš©ì ìƒì„± - UserID: skb, Name: ê¸°ë²” ì„±
2024-11-25 22:21:53: ì›ê²© ì—°ê²° ì„¤ì • ì‹œë„ - Server: 192.168.111.10, Username: administrator@hanbit.com
2024-11-25 22:21:53: ìê²© ì¦ëª… ìƒì„± ì„±ê³µ
2024-11-25 22:21:53: ì›ê²© ì„œë²„ ì—°ê²° í…ŒìŠ¤íŠ¸ ì‹œì‘
2024-11-25 22:21:53: ì›ê²© ì„œë²„ ì—°ê²° í…ŒìŠ¤íŠ¸ ì„±ê³µ
2024-11-25 22:21:53: ì›ê²© ì„¸ì…˜ ìƒì„± ì‹œë„
2024-11-25 22:21:53: ì›ê²© ì„¸ì…˜ ìƒì„± ì„±ê³µ (SessionId: 1)
2024-11-25 22:21:53: ì„¸ì…˜ ìƒíƒœ í™•ì¸ ì™„ë£Œ
2024-11-25 22:21:53: AD ì‚¬ìš©ì ìƒì„± ëª…ë ¹ ì‹¤í–‰ ì‹œì‘
2024-11-25 22:21:54: ì›ê²© ì„¸ì…˜ ì¢…ë£Œ
2024-11-25 22:21:54: ì‚¬ìš©ì ìƒì„± ì™„ë£Œ: skb
Log initialization test: 11/25/2024 22:24:26
2024-11-25 22:24:26: ìŠ¤í¬ë¦½íŠ¸ ì‹œì‘ - ê²½ë¡œ: C:\Users\woods\development\HMProject\vdi_backend\src\main\resources\scripts
2024-11-25 22:24:26: ë¡œê·¸ ë””ë ‰í† ë¦¬: C:\Users\woods\development\HMProject\vdi_backend\src\main\resources\scripts\logs
2024-11-25 22:24:26: ì‹œì‘: AD ì‚¬ìš©ì ìƒì„± - UserID: skb, Name: ê¸°ë²” ì„±
2024-11-25 22:24:26: ì›ê²© ì—°ê²° ì„¤ì • ì‹œë„ - Server: 192.168.111.10, Username: administrator@hanbit.com
2024-11-25 22:24:26: ìê²© ì¦ëª… ìƒì„± ì„±ê³µ
2024-11-25 22:24:26: ì›ê²© ì„œë²„ ì—°ê²° í…ŒìŠ¤íŠ¸ ì‹œì‘
2024-11-25 22:24:26: ì›ê²© ì„œë²„ ì—°ê²° í…ŒìŠ¤íŠ¸ ì„±ê³µ
2024-11-25 22:24:26: ì›ê²© ì„¸ì…˜ ìƒì„± ì‹œë„
2024-11-25 22:24:27: ì›ê²© ì„¸ì…˜ ìƒì„± ì„±ê³µ (SessionId: 1)
2024-11-25 22:24:27: ì„¸ì…˜ ìƒíƒœ í™•ì¸ ì™„ë£Œ
2024-11-25 22:24:27: AD ì‚¬ìš©ì ìƒì„± ëª…ë ¹ ì‹¤í–‰ ì‹œì‘
2024-11-25 22:24:28: ì›ê²© ì„¸ì…˜ ì¢…ë£Œ
2024-11-25 22:24:28: ì‚¬ìš©ì ìƒì„± ì™„ë£Œ: skb
Log initialization test: 11/25/2024 22:30:02
2024-11-25 22:30:02: ìŠ¤í¬ë¦½íŠ¸ ì‹œì‘ - ê²½ë¡œ: C:\Users\woods\development\HMProject\vdi_backend\src\main\resources\scripts
2024-11-25 22:30:02: ë¡œê·¸ ë””ë ‰í† ë¦¬: C:\Users\woods\development\HMProject\vdi_backend\src\main\resources\scripts\logs
2024-11-25 22:30:02: ì‹œì‘: AD ì‚¬ìš©ì ìƒì„± - UserID: skb, Name: ê¸°ë²” ì„±
2024-11-25 22:30:02: ì›ê²© ì—°ê²° ì„¤ì • ì‹œë„ - Server: 192.168.111.10, Username: administrator@hanbit.com
2024-11-25 22:30:02: ìê²© ì¦ëª… ìƒì„± ì„±ê³µ
2024-11-25 22:30:02: ì›ê²© ì„œë²„ ì—°ê²° í…ŒìŠ¤íŠ¸ ì‹œì‘
2024-11-25 22:30:02: ì›ê²© ì„œë²„ ì—°ê²° í…ŒìŠ¤íŠ¸ ì„±ê³µ
2024-11-25 22:30:02: ì›ê²© ì„¸ì…˜ ìƒì„± ì‹œë„
2024-11-25 22:30:03: ì›ê²© ì„¸ì…˜ ìƒì„± ì„±ê³µ (SessionId: 1)
2024-11-25 22:30:03: ì„¸ì…˜ ìƒíƒœ í™•ì¸ ì™„ë£Œ
2024-11-25 22:30:03: AD ì‚¬ìš©ì ìƒì„± ëª…ë ¹ ì‹¤í–‰ ì‹œì‘
2024-11-25 22:30:04: ì›ê²© ì„¸ì…˜ ì¢…ë£Œ
2024-11-25 22:30:04: ì‚¬ìš©ì ìƒì„± ì™„ë£Œ: skb
Log initialization test: 11/25/2024 22:30:52
2024-11-25 22:30:52: ìŠ¤í¬ë¦½íŠ¸ ì‹œì‘ - ê²½ë¡œ: C:\Users\woods\development\HMProject\vdi_backend\src\main\resources\scripts
2024-11-25 22:30:52: ë¡œê·¸ ë””ë ‰í† ë¦¬: C:\Users\woods\development\HMProject\vdi_backend\src\main\resources\scripts\logs
2024-11-25 22:30:52: ì‹œì‘: AD ì‚¬ìš©ì ìƒì„± - UserID: skb, Name: ê¸°ë²” ì„±
2024-11-25 22:30:52: ì›ê²© ì—°ê²° ì„¤ì • ì‹œë„ - Server: 192.168.111.10, Username: administrator@hanbit.com
2024-11-25 22:30:52: ìê²© ì¦ëª… ìƒì„± ì„±ê³µ
2024-11-25 22:30:52: ì›ê²© ì„œë²„ ì—°ê²° í…ŒìŠ¤íŠ¸ ì‹œì‘
2024-11-25 22:30:52: ì›ê²© ì„œë²„ ì—°ê²° í…ŒìŠ¤íŠ¸ ì„±ê³µ
2024-11-25 22:30:52: ì›ê²© ì„¸ì…˜ ìƒì„± ì‹œë„
2024-11-25 22:30:52: ì›ê²© ì„¸ì…˜ ìƒì„± ì„±ê³µ (SessionId: 1)
2024-11-25 22:30:52: ì„¸ì…˜ ìƒíƒœ í™•ì¸ ì™„ë£Œ
2024-11-25 22:30:52: AD ì‚¬ìš©ì ìƒì„± ëª…ë ¹ ì‹¤í–‰ ì‹œì‘
2024-11-25 22:30:53: ì›ê²© ì„¸ì…˜ ì¢…ë£Œ
2024-11-25 22:30:53: ì‚¬ìš©ì ìƒì„± ì™„ë£Œ: skb
Log initialization test: 11/25/2024 22:38:32
2024-11-25 22:38:32: ìŠ¤í¬ë¦½íŠ¸ ì‹œì‘ - ê²½ë¡œ: C:\Users\woods\development\HMProject\vdi_backend\src\main\resources\scripts
2024-11-25 22:38:32: ë¡œê·¸ ë””ë ‰í† ë¦¬: C:\Users\woods\development\HMProject\vdi_backend\src\main\resources\scripts\logs
2024-11-25 22:38:32: ì‹œì‘: AD ì‚¬ìš©ì ìƒì„± - UserID: skb, Name: ê¸°ë²” ì„±
2024-11-25 22:38:32: ì›ê²© ì—°ê²° ì„¤ì • ì‹œë„ - Server: 192.168.111.10, Username: administrator@hanbit.com
2024-11-25 22:38:32: ìê²© ì¦ëª… ìƒì„± ì„±ê³µ
2024-11-25 22:38:32: ì›ê²© ì„œë²„ ì—°ê²° í…ŒìŠ¤íŠ¸ ì‹œì‘
2024-11-25 22:38:32: ì›ê²© ì„œë²„ ì—°ê²° í…ŒìŠ¤íŠ¸ ì„±ê³µ
2024-11-25 22:38:32: ì›ê²© ì„¸ì…˜ ìƒì„± ì‹œë„
2024-11-25 22:38:32: ì›ê²© ì„¸ì…˜ ìƒì„± ì„±ê³µ (SessionId: 1)
2024-11-25 22:38:32: ì„¸ì…˜ ìƒíƒœ í™•ì¸ ì™„ë£Œ
2024-11-25 22:38:32: AD ì‚¬ìš©ì ìƒì„± ëª…ë ¹ ì‹¤í–‰ ì‹œì‘
2024-11-25 22:38:33: ì›ê²© ì„¸ì…˜ ì¢…ë£Œ
2024-11-25 22:38:33: ì‚¬ìš©ì ìƒì„± ì™„ë£Œ: skb
Log initialization test: 11/25/2024 22:40:59
2024-11-25 22:40:59: ìŠ¤í¬ë¦½íŠ¸ ì‹œì‘ - ê²½ë¡œ: C:\Users\woods\development\HMProject\vdi_backend\src\main\resources\scripts
2024-11-25 22:40:59: ë¡œê·¸ ë””ë ‰í† ë¦¬: C:\Users\woods\development\HMProject\vdi_backend\src\main\resources\scripts\logs
2024-11-25 22:40:59: ì‹œì‘: AD ì‚¬ìš©ì ìƒì„± - UserID: skb, Name: ê¸°ë²” ì„±
2024-11-25 22:40:59: ì›ê²© ì—°ê²° ì„¤ì • ì‹œë„ - Server: 192.168.111.10, Username: administrator@hanbit.com
2024-11-25 22:41:00: ìê²© ì¦ëª… ìƒì„± ì„±ê³µ
2024-11-25 22:41:00: ì›ê²© ì„œë²„ ì—°ê²° í…ŒìŠ¤íŠ¸ ì‹œì‘
2024-11-25 22:41:00: ì›ê²© ì„œë²„ ì—°ê²° í…ŒìŠ¤íŠ¸ ì„±ê³µ
2024-11-25 22:41:00: ì›ê²© ì„¸ì…˜ ìƒì„± ì‹œë„
2024-11-25 22:41:00: ì›ê²© ì„¸ì…˜ ìƒì„± ì„±ê³µ (SessionId: 1)
2024-11-25 22:41:00: ì„¸ì…˜ ìƒíƒœ í™•ì¸ ì™„ë£Œ
2024-11-25 22:41:00: AD ì‚¬ìš©ì ìƒì„± ëª…ë ¹ ì‹¤í–‰ ì‹œì‘
2024-11-25 22:41:01: ì›ê²© ì„¸ì…˜ ì¢…ë£Œ
2024-11-25 22:41:01: ì‚¬ìš©ì ìƒì„± ì™„ë£Œ: skb
Log initialization test: 11/25/2024 22:46:20
2024-11-25 22:46:20: ìŠ¤í¬ë¦½íŠ¸ ì‹œì‘ - ê²½ë¡œ: C:\Users\woods\development\HMProject\vdi_backend\src\main\resources\scripts
2024-11-25 22:46:20: ë¡œê·¸ ë””ë ‰í† ë¦¬: C:\Users\woods\development\HMProject\vdi_backend\src\main\resources\scripts\logs
2024-11-25 22:46:20: ì‹œì‘: AD ì‚¬ìš©ì ìƒì„± - UserID: skb, Name: ê¸°ë²” ì„±
2024-11-25 22:46:20: ì›ê²© ì—°ê²° ì„¤ì • ì‹œë„ - Server: 192.168.111.10, Username: administrator@hanbit.com
2024-11-25 22:46:20: ìê²© ì¦ëª… ìƒì„± ì„±ê³µ
2024-11-25 22:46:20: ì›ê²© ì„œë²„ ì—°ê²° í…ŒìŠ¤íŠ¸ ì‹œì‘
2024-11-25 22:46:20: ì›ê²© ì„œë²„ ì—°ê²° í…ŒìŠ¤íŠ¸ ì„±ê³µ
2024-11-25 22:46:20: ì›ê²© ì„¸ì…˜ ìƒì„± ì‹œë„
2024-11-25 22:46:20: ì›ê²© ì„¸ì…˜ ìƒì„± ì„±ê³µ (SessionId: 1)
2024-11-25 22:46:20: ì„¸ì…˜ ìƒíƒœ í™•ì¸ ì™„ë£Œ
2024-11-25 22:46:20: AD ì‚¬ìš©ì ìƒì„± ëª…ë ¹ ì‹¤í–‰ ì‹œì‘
2024-11-25 22:46:21: ì›ê²© ì„¸ì…˜ ì¢…ë£Œ
2024-11-25 22:46:21: ì‚¬ìš©ì ìƒì„± ì™„ë£Œ: skb
Log initialization test: 11/25/2024 22:48:29
2024-11-25 22:48:29: ìŠ¤í¬ë¦½íŠ¸ ì‹œì‘ - ê²½ë¡œ: C:\Users\woods\development\HMProject\vdi_backend\src\main\resources\scripts
2024-11-25 22:48:29: ë¡œê·¸ ë””ë ‰í† ë¦¬: C:\Users\woods\development\HMProject\vdi_backend\src\main\resources\scripts\logs
2024-11-25 22:48:29: ì‹œì‘: AD ì‚¬ìš©ì ìƒì„± - UserID: skb, Name: ê¸°ë²” ì„±
2024-11-25 22:48:29: ì›ê²© ì—°ê²° ì„¤ì • ì‹œë„ - Server: 192.168.111.10, Username: administrator@hanbit.com
2024-11-25 22:48:29: ìê²© ì¦ëª… ìƒì„± ì„±ê³µ
2024-11-25 22:48:29: ì›ê²© ì„œë²„ ì—°ê²° í…ŒìŠ¤íŠ¸ ì‹œì‘
2024-11-25 22:48:29: ì›ê²© ì„œë²„ ì—°ê²° í…ŒìŠ¤íŠ¸ ì„±ê³µ
2024-11-25 22:48:29: ì›ê²© ì„¸ì…˜ ìƒì„± ì‹œë„
2024-11-25 22:48:30: ì›ê²© ì„¸ì…˜ ìƒì„± ì„±ê³µ (SessionId: 1)
2024-11-25 22:48:30: ì„¸ì…˜ ìƒíƒœ í™•ì¸ ì™„ë£Œ
2024-11-25 22:48:30: AD ì‚¬ìš©ì ìƒì„± ëª…ë ¹ ì‹¤í–‰ ì‹œì‘
2024-11-25 22:48:31: ì›ê²© ì„¸ì…˜ ì¢…ë£Œ
2024-11-25 22:48:31: ì‚¬ìš©ì ìƒì„± ì™„ë£Œ: skb
Log initialization test: 11/25/2024 22:51:44
2024-11-25 22:51:44: ìŠ¤í¬ë¦½íŠ¸ ì‹œì‘ - ê²½ë¡œ: C:\Users\woods\development\HMProject\vdi_backend\src\main\resources\scripts
2024-11-25 22:51:44: ë¡œê·¸ ë””ë ‰í† ë¦¬: C:\Users\woods\development\HMProject\vdi_backend\src\main\resources\scripts\logs
2024-11-25 22:51:44: ì‹œì‘: AD ì‚¬ìš©ì ìƒì„± - UserID: skb, Name: ê¸°ë²” ì„±
2024-11-25 22:51:44: ì›ê²© ì—°ê²° ì„¤ì • ì‹œë„ - Server: 192.168.111.10, Username: administrator@hanbit.com
2024-11-25 22:51:44: ìê²© ì¦ëª… ìƒì„± ì„±ê³µ
2024-11-25 22:51:44: ì›ê²© ì„œë²„ ì—°ê²° í…ŒìŠ¤íŠ¸ ì‹œì‘
2024-11-25 22:51:44: ì›ê²© ì„œë²„ ì—°ê²° í…ŒìŠ¤íŠ¸ ì„±ê³µ
2024-11-25 22:51:44: ì›ê²© ì„¸ì…˜ ìƒì„± ì‹œë„
2024-11-25 22:51:44: ì›ê²© ì„¸ì…˜ ìƒì„± ì„±ê³µ (SessionId: 1)
2024-11-25 22:51:44: ì„¸ì…˜ ìƒíƒœ í™•ì¸ ì™„ë£Œ
2024-11-25 22:51:44: AD ì‚¬ìš©ì ìƒì„± ëª…ë ¹ ì‹¤í–‰ ì‹œì‘
2024-11-25 22:51:45: ì›ê²© ì„¸ì…˜ ì¢…ë£Œ
2024-11-25 22:51:45: ì‚¬ìš©ì ìƒì„± ì™„ë£Œ: skb
Log initialization test: 11/25/2024 23:00:34
2024-11-25 23:00:34: ìŠ¤í¬ë¦½íŠ¸ ì‹œì‘ - ê²½ë¡œ: C:\Users\woods\development\HMProject\vdi_backend\src\main\resources\scripts
2024-11-25 23:00:34: ë¡œê·¸ ë””ë ‰í† ë¦¬: C:\Users\woods\development\HMProject\vdi_backend\src\main\resources\scripts\logs
2024-11-25 23:00:34: ì‹œì‘: AD ì‚¬ìš©ì ìƒì„± - UserID: skb, Name: ê¸°ë²” ì„±
2024-11-25 23:00:34: ì›ê²© ì—°ê²° ì„¤ì • ì‹œë„ - Server: 192.168.111.10, Username: administrator@hanbit.com
2024-11-25 23:00:34: ìê²© ì¦ëª… ìƒì„± ì„±ê³µ
2024-11-25 23:00:34: ì›ê²© ì„œë²„ ì—°ê²° í…ŒìŠ¤íŠ¸ ì‹œì‘
2024-11-25 23:00:34: ì›ê²© ì„œë²„ ì—°ê²° í…ŒìŠ¤íŠ¸ ì„±ê³µ
2024-11-25 23:00:34: ì›ê²© ì„¸ì…˜ ìƒì„± ì‹œë„
2024-11-25 23:00:34: ì›ê²© ì„¸ì…˜ ìƒì„± ì„±ê³µ (SessionId: 1)
2024-11-25 23:00:34: ì„¸ì…˜ ìƒíƒœ í™•ì¸ ì™„ë£Œ
2024-11-25 23:00:34: AD ì‚¬ìš©ì ìƒì„± ëª…ë ¹ ì‹¤í–‰ ì‹œì‘
2024-11-25 23:00:36: ì›ê²© ì„¸ì…˜ ì¢…ë£Œ
2024-11-25 23:00:36: ì‚¬ìš©ì ìƒì„± ì™„ë£Œ: skb
Log initialization test: 11/25/2024 23:01:39
2024-11-25 23:01:39: ìŠ¤í¬ë¦½íŠ¸ ì‹œì‘ - ê²½ë¡œ: C:\Users\woods\development\HMProject\vdi_backend\src\main\resources\scripts
2024-11-25 23:01:39: ë¡œê·¸ ë””ë ‰í† ë¦¬: C:\Users\woods\development\HMProject\vdi_backend\src\main\resources\scripts\logs
2024-11-25 23:01:39: ì‹œì‘: AD ì‚¬ìš©ì ìƒì„± - UserID: skb, Name: ê¸°ë²” ì„±
2024-11-25 23:01:39: ì›ê²© ì—°ê²° ì„¤ì • ì‹œë„ - Server: 192.168.111.10, Username: administrator@hanbit.com
2024-11-25 23:01:40: ìê²© ì¦ëª… ìƒì„± ì„±ê³µ
2024-11-25 23:01:40: ì›ê²© ì„œë²„ ì—°ê²° í…ŒìŠ¤íŠ¸ ì‹œì‘
2024-11-25 23:01:40: ì›ê²© ì„œë²„ ì—°ê²° í…ŒìŠ¤íŠ¸ ì„±ê³µ
2024-11-25 23:01:40: ì›ê²© ì„¸ì…˜ ìƒì„± ì‹œë„
2024-11-25 23:01:40: ì›ê²© ì„¸ì…˜ ìƒì„± ì„±ê³µ (SessionId: 1)
2024-11-25 23:01:40: ì„¸ì…˜ ìƒíƒœ í™•ì¸ ì™„ë£Œ
2024-11-25 23:01:40: AD ì‚¬ìš©ì ìƒì„± ëª…ë ¹ ì‹¤í–‰ ì‹œì‘
2024-11-25 23:01:40: ì›ê²© ì„¸ì…˜ ì¢…ë£Œ
2024-11-25 23:01:40: ì‚¬ìš©ì ìƒì„± ì™„ë£Œ: skb
Log initialization test: 11/25/2024 23:04:58
2024-11-25 23:04:58: ìŠ¤í¬ë¦½íŠ¸ ì‹œì‘ - ê²½ë¡œ: C:\Users\woods\development\HMProject\vdi_backend\src\main\resources\scripts
2024-11-25 23:04:58: ë¡œê·¸ ë””ë ‰í† ë¦¬: C:\Users\woods\development\HMProject\vdi_backend\src\main\resources\scripts\logs
2024-11-25 23:04:58: ì‹œì‘: AD ì‚¬ìš©ì ìƒì„± - UserID: skb, Name: ê¸°ë²” ì„±
2024-11-25 23:04:58: ì›ê²© ì—°ê²° ì„¤ì • ì‹œë„ - Server: 192.168.111.10, Username: administrator@hanbit.com
2024-11-25 23:04:58: ìê²© ì¦ëª… ìƒì„± ì„±ê³µ
2024-11-25 23:04:58: ì›ê²© ì„œë²„ ì—°ê²° í…ŒìŠ¤íŠ¸ ì‹œì‘
2024-11-25 23:04:58: ì›ê²© ì„œë²„ ì—°ê²° í…ŒìŠ¤íŠ¸ ì„±ê³µ
2024-11-25 23:04:58: ì›ê²© ì„¸ì…˜ ìƒì„± ì‹œë„
2024-11-25 23:04:58: ì›ê²© ì„¸ì…˜ ìƒì„± ì„±ê³µ (SessionId: 1)
2024-11-25 23:04:58: ì„¸ì…˜ ìƒíƒœ í™•ì¸ ì™„ë£Œ
2024-11-25 23:04:58: AD ì‚¬ìš©ì ìƒì„± ëª…ë ¹ ì‹¤í–‰ ì‹œì‘
2024-11-25 23:04:59: ì›ê²© ì„¸ì…˜ ì¢…ë£Œ
2024-11-25 23:04:59: ì‚¬ìš©ì ìƒì„± ì™„ë£Œ: skb
Log initialization test: 11/28/2024 19:50:18
2024-11-28 19:50:18: ìŠ¤í¬ë¦½íŠ¸ ì‹œì‘ - ê²½ë¡œ: C:\Users\woods\development\HMProject\vdi_backend\src\main\resources\scripts
2024-11-28 19:50:18: ë¡œê·¸ ë””ë ‰í† ë¦¬: C:\Users\woods\development\HMProject\vdi_backend\src\main\resources\scripts\logs
2024-11-28 19:50:18: ì‹œì‘: AD ì‚¬ìš©ì ìƒì„± - UserID: skb, Name: ê¸°ë²” ì„±
2024-11-28 19:50:18: ì›ê²© ì—°ê²° ì„¤ì • ì‹œë„ - Server: 192.168.111.10, Username: administrator@hanbit.com
2024-11-28 19:50:18: ìê²© ì¦ëª… ìƒì„± ì„±ê³µ
2024-11-28 19:50:18: ì›ê²© ì„œë²„ ì—°ê²° í…ŒìŠ¤íŠ¸ ì‹œì‘
2024-11-28 19:50:18: ì›ê²© ì„œë²„ ì—°ê²° í…ŒìŠ¤íŠ¸ ì„±ê³µ
2024-11-28 19:50:18: ì›ê²© ì„¸ì…˜ ìƒì„± ì‹œë„
2024-11-28 19:50:19: ì›ê²© ì„¸ì…˜ ìƒì„± ì„±ê³µ (SessionId: 1)
2024-11-28 19:50:19: ì„¸ì…˜ ìƒíƒœ í™•ì¸ ì™„ë£Œ
2024-11-28 19:50:19: AD ì‚¬ìš©ì ìƒì„± ëª…ë ¹ ì‹¤í–‰ ì‹œì‘
2024-11-28 19:50:20: ì›ê²© ì„¸ì…˜ ì¢…ë£Œ
2024-11-28 19:50:20: ì‚¬ìš©ì ìƒì„± ì™„ë£Œ: skb
Log initialization test: 12/05/2024 20:11:19
2024-12-05 20:11:19: ìŠ¤í¬ë¦½íŠ¸ ì‹œì‘ - ê²½ë¡œ: C:\Users\woods\development\HMProject\vdi_backend\src\main\resources\scripts
2024-12-05 20:11:19: ë¡œê·¸ ë””ë ‰í† ë¦¬: C:\Users\woods\development\HMProject\vdi_backend\src\main\resources\scripts\logs
2024-12-05 20:11:19: ì‹œì‘: AD ì‚¬ìš©ì ìƒì„± - UserID: skb, Name: ê¸°ë²” ì„±
2024-12-05 20:11:19: ì›ê²© ì—°ê²° ì„¤ì • ì‹œë„ - Server: 192.168.111.10, Username: administrator@hanbit.com
2024-12-05 20:11:19: ìê²© ì¦ëª… ìƒì„± ì„±ê³µ
2024-12-05 20:11:19: ì›ê²© ì„œë²„ ì—°ê²° í…ŒìŠ¤íŠ¸ ì‹œì‘
2024-12-05 20:11:19: ì›ê²© ì„œë²„ ì—°ê²° í…ŒìŠ¤íŠ¸ ì„±ê³µ
2024-12-05 20:11:19: ì›ê²© ì„¸ì…˜ ìƒì„± ì‹œë„
2024-12-05 20:11:20: ì›ê²© ì„¸ì…˜ ìƒì„± ì„±ê³µ (SessionId: 1)
2024-12-05 20:11:20: ì„¸ì…˜ ìƒíƒœ í™•ì¸ ì™„ë£Œ
2024-12-05 20:11:20: AD ì‚¬ìš©ì ìƒì„± ëª…ë ¹ ì‹¤í–‰ ì‹œì‘
2024-12-05 20:11:21: ì›ê²© ì„¸ì…˜ ì¢…ë£Œ
2024-12-05 20:11:21: ì‚¬ìš©ì ìƒì„± ì™„ë£Œ: skb
Log initialization test: 12/05/2024 20:18:04
2024-12-05 20:18:04: ìŠ¤í¬ë¦½íŠ¸ ì‹œì‘ - ê²½ë¡œ: C:\Users\woods\development\HMProject\vdi_backend\src\main\resources\scripts
2024-12-05 20:18:04: ë¡œê·¸ ë””ë ‰í† ë¦¬: C:\Users\woods\development\HMProject\vdi_backend\src\main\resources\scripts\logs
2024-12-05 20:18:04: ì‹œì‘: AD ì‚¬ìš©ì ìƒì„± - UserID: skb, Name: ê¸°ë²” ì„±
2024-12-05 20:18:04: ì›ê²© ì—°ê²° ì„¤ì • ì‹œë„ - Server: 192.168.111.10, Username: administrator@hanbit.com
2024-12-05 20:18:04: ìê²© ì¦ëª… ìƒì„± ì„±ê³µ
2024-12-05 20:18:04: ì›ê²© ì„œë²„ ì—°ê²° í…ŒìŠ¤íŠ¸ ì‹œì‘
2024-12-05 20:18:04: ì›ê²© ì„œë²„ ì—°ê²° í…ŒìŠ¤íŠ¸ ì„±ê³µ
2024-12-05 20:18:04: ì›ê²© ì„¸ì…˜ ìƒì„± ì‹œë„
2024-12-05 20:18:04: ì›ê²© ì„¸ì…˜ ìƒì„± ì„±ê³µ (SessionId: 1)
2024-12-05 20:18:04: ì„¸ì…˜ ìƒíƒœ í™•ì¸ ì™„ë£Œ
2024-12-05 20:18:04: AD ì‚¬ìš©ì ìƒì„± ëª…ë ¹ ì‹¤í–‰ ì‹œì‘
2024-12-05 20:18:05: ì›ê²© ì„¸ì…˜ ì¢…ë£Œ
2024-12-05 20:18:05: ì‚¬ìš©ì ìƒì„± ì™„ë£Œ: skb
Log initialization test: 12/05/2024 20:50:15
2024-12-05 20:50:15: ìŠ¤í¬ë¦½íŠ¸ ì‹œì‘ - ê²½ë¡œ: C:\Users\woods\development\HMProject\vdi_backend\src\main\resources\scripts
2024-12-05 20:50:15: ë¡œê·¸ ë””ë ‰í† ë¦¬: C:\Users\woods\development\HMProject\vdi_backend\src\main\resources\scripts\logs
2024-12-05 20:50:15: ì‹œì‘: AD ì‚¬ìš©ì ìƒì„± - UserID: skb, Name: ê¸°ë²” ì„±
2024-12-05 20:50:15: ì›ê²© ì—°ê²° ì„¤ì • ì‹œë„ - Server: 192.168.111.10, Username: administrator@hanbit.com
2024-12-05 20:50:15: ìê²© ì¦ëª… ìƒì„± ì„±ê³µ
2024-12-05 20:50:15: ì›ê²© ì„œë²„ ì—°ê²° í…ŒìŠ¤íŠ¸ ì‹œì‘
2024-12-05 20:50:15: ì›ê²© ì„œë²„ ì—°ê²° í…ŒìŠ¤íŠ¸ ì„±ê³µ
2024-12-05 20:50:15: ì›ê²© ì„¸ì…˜ ìƒì„± ì‹œë„
2024-12-05 20:50:15: ì›ê²© ì„¸ì…˜ ìƒì„± ì„±ê³µ (SessionId: 1)
2024-12-05 20:50:15: ì„¸ì…˜ ìƒíƒœ í™•ì¸ ì™„ë£Œ
2024-12-05 20:50:15: AD ì‚¬ìš©ì ìƒì„± ëª…ë ¹ ì‹¤í–‰ ì‹œì‘
2024-12-05 20:50:16: ì›ê²© ì„¸ì…˜ ì¢…ë£Œ
2024-12-05 20:50:16: ì‚¬ìš©ì ìƒì„± ì™„ë£Œ: skb
Log initialization test: 12/05/2024 20:50:41
2024-12-05 20:50:41: ìŠ¤í¬ë¦½íŠ¸ ì‹œì‘ - ê²½ë¡œ: C:\Users\woods\development\HMProject\vdi_backend\src\main\resources\scripts
2024-12-05 20:50:41: ë¡œê·¸ ë””ë ‰í† ë¦¬: C:\Users\woods\development\HMProject\vdi_backend\src\main\resources\scripts\logs
2024-12-05 20:50:41: ì‹œì‘: AD ì‚¬ìš©ì ìƒì„± - UserID: skb, Name: ê¸°ë²” ì„±
2024-12-05 20:50:41: ì›ê²© ì—°ê²° ì„¤ì • ì‹œë„ - Server: 192.168.111.10, Username: administrator@hanbit.com
2024-12-05 20:50:41: ìê²© ì¦ëª… ìƒì„± ì„±ê³µ
2024-12-05 20:50:41: ì›ê²© ì„œë²„ ì—°ê²° í…ŒìŠ¤íŠ¸ ì‹œì‘
2024-12-05 20:50:41: ì›ê²© ì„œë²„ ì—°ê²° í…ŒìŠ¤íŠ¸ ì„±ê³µ
2024-12-05 20:50:41: ì›ê²© ì„¸ì…˜ ìƒì„± ì‹œë„
2024-12-05 20:50:41: ì›ê²© ì„¸ì…˜ ìƒì„± ì„±ê³µ (SessionId: 1)
2024-12-05 20:50:41: ì„¸ì…˜ ìƒíƒœ í™•ì¸ ì™„ë£Œ
2024-12-05 20:50:41: AD ì‚¬ìš©ì ìƒì„± ëª…ë ¹ ì‹¤í–‰ ì‹œì‘
2024-12-05 20:50:42: ì›ê²© ì„¸ì…˜ ì¢…ë£Œ
2024-12-05 20:50:42: ì‚¬ìš©ì ìƒì„± ì™„ë£Œ: skb
Log initialization test: 12/05/2024 20:51:56
2024-12-05 20:51:56: ìŠ¤í¬ë¦½íŠ¸ ì‹œì‘ - ê²½ë¡œ: C:\Users\woods\development\HMProject\vdi_backend\src\main\resources\scripts
2024-12-05 20:51:56: ë¡œê·¸ ë””ë ‰í† ë¦¬: C:\Users\woods\development\HMProject\vdi_backend\src\main\resources\scripts\logs
2024-12-05 20:51:56: ì‹œì‘: AD ì‚¬ìš©ì ìƒì„± - UserID: skb, Name: ê¸°ë²” ì„±
2024-12-05 20:51:56: ì›ê²© ì—°ê²° ì„¤ì • ì‹œë„ - Server: 192.168.111.10, Username: administrator@hanbit.com
2024-12-05 20:51:56: ìê²© ì¦ëª… ìƒì„± ì„±ê³µ
2024-12-05 20:51:56: ì›ê²© ì„œë²„ ì—°ê²° í…ŒìŠ¤íŠ¸ ì‹œì‘
2024-12-05 20:51:56: ì›ê²© ì„œë²„ ì—°ê²° í…ŒìŠ¤íŠ¸ ì„±ê³µ
2024-12-05 20:51:56: ì›ê²© ì„¸ì…˜ ìƒì„± ì‹œë„
2024-12-05 20:51:56: ì›ê²© ì„¸ì…˜ ìƒì„± ì„±ê³µ (SessionId: 1)
2024-12-05 20:51:56: ì„¸ì…˜ ìƒíƒœ í™•ì¸ ì™„ë£Œ
2024-12-05 20:51:56: AD ì‚¬ìš©ì ìƒì„± ëª…ë ¹ ì‹¤í–‰ ì‹œì‘
2024-12-05 20:51:57: ì›ê²© ì„¸ì…˜ ì¢…ë£Œ
2024-12-05 20:51:57: ì‚¬ìš©ì ìƒì„± ì™„ë£Œ: skb
Log initialization test: 12/05/2024 21:11:15
2024-12-05 21:11:15: ìŠ¤í¬ë¦½íŠ¸ ì‹œì‘ - ê²½ë¡œ: C:\Users\woods\development\HMProject\vdi_backend\src\main\resources\scripts
2024-12-05 21:11:15: ë¡œê·¸ ë””ë ‰í† ë¦¬: C:\Users\woods\development\HMProject\vdi_backend\src\main\resources\scripts\logs
2024-12-05 21:11:15: ì‹œì‘: AD ì‚¬ìš©ì ìƒì„± - UserID: skb, Name: ê¸°ë²” ì„±
2024-12-05 21:11:15: ì›ê²© ì—°ê²° ì„¤ì • ì‹œë„ - Server: 192.168.111.10, Username: administrator@hanbit.com
2024-12-05 21:11:15: ìê²© ì¦ëª… ìƒì„± ì„±ê³µ
2024-12-05 21:11:15: ì›ê²© ì„œë²„ ì—°ê²° í…ŒìŠ¤íŠ¸ ì‹œì‘
2024-12-05 21:11:15: ì›ê²© ì„œë²„ ì—°ê²° í…ŒìŠ¤íŠ¸ ì„±ê³µ
2024-12-05 21:11:15: ì›ê²© ì„¸ì…˜ ìƒì„± ì‹œë„
2024-12-05 21:11:15: ì›ê²© ì„¸ì…˜ ìƒì„± ì„±ê³µ (SessionId: 1)
2024-12-05 21:11:15: ì„¸ì…˜ ìƒíƒœ í™•ì¸ ì™„ë£Œ
2024-12-05 21:11:15: AD ì‚¬ìš©ì ìƒì„± ëª…ë ¹ ì‹¤í–‰ ì‹œì‘
2024-12-05 21:11:16: ì›ê²© ì„¸ì…˜ ì¢…ë£Œ
2024-12-05 21:11:16: ì‚¬ìš©ì ìƒì„± ì™„ë£Œ: skb
Log initialization test: 12/08/2024 18:53:34
2024-12-08 18:53:34: ìŠ¤í¬ë¦½íŠ¸ ì‹œì‘ - ê²½ë¡œ: C:\Users\woods\development\HMProject\vdi_backend\src\main\resources\scripts
2024-12-08 18:53:34: ë¡œê·¸ ë””ë ‰í† ë¦¬: C:\Users\woods\development\HMProject\vdi_backend\src\main\resources\scripts\logs
2024-12-08 18:53:34: ì‹œì‘: AD ì‚¬ìš©ì ìƒì„± - UserID: skb, Name: ê¸°ë²” ì„±
2024-12-08 18:53:34: ì›ê²© ì—°ê²° ì„¤ì • ì‹œë„ - Server: 192.168.111.10, Username: administrator@hanbit.com
2024-12-08 18:53:34: ìê²© ì¦ëª… ìƒì„± ì„±ê³µ
2024-12-08 18:53:34: ì›ê²© ì„œë²„ ì—°ê²° í…ŒìŠ¤íŠ¸ ì‹œì‘
2024-12-08 18:53:34: ì›ê²© ì„œë²„ ì—°ê²° í…ŒìŠ¤íŠ¸ ì„±ê³µ
2024-12-08 18:53:34: ì›ê²© ì„¸ì…˜ ìƒì„± ì‹œë„
2024-12-08 18:53:34: ì›ê²© ì„¸ì…˜ ìƒì„± ì„±ê³µ (SessionId: 1)
2024-12-08 18:53:34: ì„¸ì…˜ ìƒíƒœ í™•ì¸ ì™„ë£Œ
2024-12-08 18:53:34: AD ì‚¬ìš©ì ìƒì„± ëª…ë ¹ ì‹¤í–‰ ì‹œì‘
2024-12-08 18:53:36: ì›ê²© ì„¸ì…˜ ì¢…ë£Œ
2024-12-08 18:53:36: ì‚¬ìš©ì ìƒì„± ì™„ë£Œ: skb
Log initialization test: 12/11/2024 20:36:26
2024-12-11 20:36:26: ìŠ¤í¬ë¦½íŠ¸ ì‹œì‘ - ê²½ë¡œ: C:\Users\woods\development\HMProject\vdi_backend\src\main\resources\scripts
2024-12-11 20:36:26: ë¡œê·¸ ë””ë ‰í† ë¦¬: C:\Users\woods\development\HMProject\vdi_backend\src\main\resources\scripts\logs
2024-12-11 20:36:26: ì‹œì‘: AD ì‚¬ìš©ì ìƒì„± - UserID: skb, Name: ê¸°ë²” ì„±
2024-12-11 20:36:26: ì›ê²© ì—°ê²° ì„¤ì • ì‹œë„ - Server: 192.168.111.10, Username: administrator@hanbit.com
2024-12-11 20:36:26: ìê²© ì¦ëª… ìƒì„± ì„±ê³µ
2024-12-11 20:36:26: ì›ê²© ì„œë²„ ì—°ê²° í…ŒìŠ¤íŠ¸ ì‹œì‘
2024-12-11 20:36:26: ì›ê²© ì„œë²„ ì—°ê²° í…ŒìŠ¤íŠ¸ ì„±ê³µ
2024-12-11 20:36:26: ì›ê²© ì„¸ì…˜ ìƒì„± ì‹œë„
2024-12-11 20:36:26: ì›ê²© ì„¸ì…˜ ìƒì„± ì„±ê³µ (SessionId: 1)
2024-12-11 20:36:26: ì„¸ì…˜ ìƒíƒœ í™•ì¸ ì™„ë£Œ
2024-12-11 20:36:26: AD ì‚¬ìš©ì ìƒì„± ëª…ë ¹ ì‹¤í–‰ ì‹œì‘
2024-12-11 20:36:28: ì›ê²© ì„¸ì…˜ ì¢…ë£Œ
2024-12-11 20:36:28: ì‚¬ìš©ì ìƒì„± ì™„ë£Œ: skb
Log initialization test: 12/14/2024 18:31:44
2024-12-14 18:31:44: ìŠ¤í¬ë¦½íŠ¸ ì‹œì‘ - ê²½ë¡œ: C:\Users\woods\development\HMProject\vdi_backend\src\main\resources\scripts
2024-12-14 18:31:44: ë¡œê·¸ ë””ë ‰í† ë¦¬: C:\Users\woods\development\HMProject\vdi_backend\src\main\resources\scripts\logs
2024-12-14 18:31:44: ì‹œì‘: AD ì‚¬ìš©ì ìƒì„± - UserID: skb, Name: ê¸°ë²” ì„±
2024-12-14 18:31:44: ì›ê²© ì—°ê²° ì„¤ì • ì‹œë„ - Server: 192.168.111.10, Username: administrator@hanbit.com
2024-12-14 18:31:44: ìê²© ì¦ëª… ìƒì„± ì„±ê³µ
2024-12-14 18:31:44: ì›ê²© ì„œë²„ ì—°ê²° í…ŒìŠ¤íŠ¸ ì‹œì‘
2024-12-14 18:31:44: ì›ê²© ì„œë²„ ì—°ê²° í…ŒìŠ¤íŠ¸ ì„±ê³µ
2024-12-14 18:31:44: ì›ê²© ì„¸ì…˜ ìƒì„± ì‹œë„
2024-12-14 18:31:44: ì›ê²© ì„¸ì…˜ ìƒì„± ì„±ê³µ (SessionId: 1)
2024-12-14 18:31:44: ì„¸ì…˜ ìƒíƒœ í™•ì¸ ì™„ë£Œ
2024-12-14 18:31:44: AD ì‚¬ìš©ì ìƒì„± ëª…ë ¹ ì‹¤í–‰ ì‹œì‘
2024-12-14 18:31:45: ì›ê²© ì„¸ì…˜ ì¢…ë£Œ
2024-12-14 18:31:45: ì‚¬ìš©ì ìƒì„± ì™„ë£Œ: skb
Log initialization test: 12/14/2024 20:56:25
2024-12-14 20:56:25: ìŠ¤í¬ë¦½íŠ¸ ì‹œì‘ - ê²½ë¡œ: C:\Users\woods\development\HMProject\vdi_backend\src\main\resources\scripts
2024-12-14 20:56:25: ë¡œê·¸ ë””ë ‰í† ë¦¬: C:\Users\woods\development\HMProject\vdi_backend\src\main\resources\scripts\logs
2024-12-14 20:56:25: ì‹œì‘: AD ì‚¬ìš©ì ìƒì„± - UserID: skb, Name: ê¸°ë²” ì„±
2024-12-14 20:56:25: ì›ê²© ì—°ê²° ì„¤ì • ì‹œë„ - Server: 192.168.111.10, Username: administrator@hanbit.com
2024-12-14 20:56:25: ìê²© ì¦ëª… ìƒì„± ì„±ê³µ
2024-12-14 20:56:25: ì›ê²© ì„œë²„ ì—°ê²° í…ŒìŠ¤íŠ¸ ì‹œì‘
2024-12-14 20:56:25: ì›ê²© ì„œë²„ ì—°ê²° í…ŒìŠ¤íŠ¸ ì„±ê³µ
2024-12-14 20:56:25: ì›ê²© ì„¸ì…˜ ìƒì„± ì‹œë„
2024-12-14 20:56:26: ì›ê²© ì„¸ì…˜ ìƒì„± ì„±ê³µ (SessionId: 1)
2024-12-14 20:56:26: ì„¸ì…˜ ìƒíƒœ í™•ì¸ ì™„ë£Œ
2024-12-14 20:56:26: AD ì‚¬ìš©ì ìƒì„± ëª…ë ¹ ì‹¤í–‰ ì‹œì‘
2024-12-14 20:56:27: ì›ê²© ì„¸ì…˜ ì¢…ë£Œ
2024-12-14 20:56:27: ì‚¬ìš©ì ìƒì„± ì™„ë£Œ: skb
Log initialization test: 12/14/2024 21:05:00
2024-12-14 21:05:00: ìŠ¤í¬ë¦½íŠ¸ ì‹œì‘ - ê²½ë¡œ: C:\Users\woods\development\HMProject\vdi_backend\src\main\resources\scripts
2024-12-14 21:05:00: ë¡œê·¸ ë””ë ‰í† ë¦¬: C:\Users\woods\development\HMProject\vdi_backend\src\main\resources\scripts\logs
2024-12-14 21:05:00: ì‹œì‘: AD ì‚¬ìš©ì ìƒì„± - UserID: skb, Name: ê¸°ë²” ì„±
2024-12-14 21:05:00: ì›ê²© ì—°ê²° ì„¤ì • ì‹œë„ - Server: 192.168.111.10, Username: administrator@hanbit.com
2024-12-14 21:05:00: ìê²© ì¦ëª… ìƒì„± ì„±ê³µ
2024-12-14 21:05:00: ì›ê²© ì„œë²„ ì—°ê²° í…ŒìŠ¤íŠ¸ ì‹œì‘
2024-12-14 21:05:00: ì›ê²© ì„œë²„ ì—°ê²° í…ŒìŠ¤íŠ¸ ì„±ê³µ
2024-12-14 21:05:00: ì›ê²© ì„¸ì…˜ ìƒì„± ì‹œë„
2024-12-14 21:05:00: ì›ê²© ì„¸ì…˜ ìƒì„± ì„±ê³µ (SessionId: 1)
2024-12-14 21:05:00: ì„¸ì…˜ ìƒíƒœ í™•ì¸ ì™„ë£Œ
2024-12-14 21:05:00: AD ì‚¬ìš©ì ìƒì„± ëª…ë ¹ ì‹¤í–‰ ì‹œì‘
2024-12-14 21:05:01: ì›ê²© ì„¸ì…˜ ì¢…ë£Œ
2024-12-14 21:05:01: ì‚¬ìš©ì ìƒì„± ì™„ë£Œ: skb
Log initialization test: 12/14/2024 21:05:44
2024-12-14 21:05:44: ìŠ¤í¬ë¦½íŠ¸ ì‹œì‘ - ê²½ë¡œ: C:\Users\woods\development\HMProject\vdi_backend\src\main\resources\scripts
2024-12-14 21:05:44: ë¡œê·¸ ë””ë ‰í† ë¦¬: C:\Users\woods\development\HMProject\vdi_backend\src\main\resources\scripts\logs
2024-12-14 21:05:44: ì‹œì‘: AD ì‚¬ìš©ì ìƒì„± - UserID: skb, Name: ê¸°ë²” ì„±
2024-12-14 21:05:44: ì›ê²© ì—°ê²° ì„¤ì • ì‹œë„ - Server: 192.168.111.10, Username: administrator@hanbit.com
2024-12-14 21:05:44: ìê²© ì¦ëª… ìƒì„± ì„±ê³µ
2024-12-14 21:05:44: ì›ê²© ì„œë²„ ì—°ê²° í…ŒìŠ¤íŠ¸ ì‹œì‘
2024-12-14 21:05:44: ì›ê²© ì„œë²„ ì—°ê²° í…ŒìŠ¤íŠ¸ ì„±ê³µ
2024-12-14 21:05:44: ì›ê²© ì„¸ì…˜ ìƒì„± ì‹œë„
2024-12-14 21:05:44: ì›ê²© ì„¸ì…˜ ìƒì„± ì„±ê³µ (SessionId: 1)
2024-12-14 21:05:44: ì„¸ì…˜ ìƒíƒœ í™•ì¸ ì™„ë£Œ
2024-12-14 21:05:44: AD ì‚¬ìš©ì ìƒì„± ëª…ë ¹ ì‹¤í–‰ ì‹œì‘
2024-12-14 21:05:45: ì›ê²© ì„¸ì…˜ ì¢…ë£Œ
2024-12-14 21:05:45: ì‚¬ìš©ì ìƒì„± ì™„ë£Œ: skb
Log initialization test: 12/17/2024 21:14:11
2024-12-17 21:14:11: ìŠ¤í¬ë¦½íŠ¸ ì‹œì‘ - ê²½ë¡œ: C:\Users\woods\development\HMProject\vdi_backend\src\main\resources\scripts
2024-12-17 21:14:11: ë¡œê·¸ ë””ë ‰í† ë¦¬: C:\Users\woods\development\HMProject\vdi_backend\src\main\resources\scripts\logs
2024-12-17 21:14:11: ì‹œì‘: AD ì‚¬ìš©ì ìƒì„± - UserID: skb, Name: ê¸°ë²” ì„±
2024-12-17 21:14:11: ì›ê²© ì—°ê²° ì„¤ì • ì‹œë„ - Server: 192.168.111.10, Username: administrator@hanbit.com
2024-12-17 21:14:11: ìê²© ì¦ëª… ìƒì„± ì„±ê³µ
2024-12-17 21:14:11: ì›ê²© ì„œë²„ ì—°ê²° í…ŒìŠ¤íŠ¸ ì‹œì‘
2024-12-17 21:14:11: ì›ê²© ì„œë²„ ì—°ê²° í…ŒìŠ¤íŠ¸ ì„±ê³µ
2024-12-17 21:14:11: ì›ê²© ì„¸ì…˜ ìƒì„± ì‹œë„
2024-12-17 21:14:11: ì›ê²© ì„¸ì…˜ ìƒì„± ì„±ê³µ (SessionId: 1)
2024-12-17 21:14:11: ì„¸ì…˜ ìƒíƒœ í™•ì¸ ì™„ë£Œ
2024-12-17 21:14:11: AD ì‚¬ìš©ì ìƒì„± ëª…ë ¹ ì‹¤í–‰ ì‹œì‘
2024-12-17 21:14:13: ì›ê²© ì„¸ì…˜ ì¢…ë£Œ
2024-12-17 21:14:13: ì‚¬ìš©ì ìƒì„± ì™„ë£Œ: skb
Log initialization test: 12/19/2024 20:24:32
2024-12-19 20:24:32: ìŠ¤í¬ë¦½íŠ¸ ì‹œì‘ - ê²½ë¡œ: C:\Users\woods\development\HMProject\vdi_backend\src\main\resources\scripts
2024-12-19 20:24:32: ë¡œê·¸ ë””ë ‰í† ë¦¬: C:\Users\woods\development\HMProject\vdi_backend\src\main\resources\scripts\logs
2024-12-19 20:24:32: ì‹œì‘: AD ì‚¬ìš©ì ìƒì„± - UserID: skb, Name: ê¸°ë²” ì„±
2024-12-19 20:24:32: ì›ê²© ì—°ê²° ì„¤ì • ì‹œë„ - Server: 192.168.111.10, Username: administrator@hanbit.com
2024-12-19 20:24:32: ìê²© ì¦ëª… ìƒì„± ì„±ê³µ
2024-12-19 20:24:32: ì›ê²© ì„œë²„ ì—°ê²° í…ŒìŠ¤íŠ¸ ì‹œì‘
2024-12-19 20:24:32: ì›ê²© ì„œë²„ ì—°ê²° í…ŒìŠ¤íŠ¸ ì„±ê³µ
2024-12-19 20:24:32: ì›ê²© ì„¸ì…˜ ìƒì„± ì‹œë„
2024-12-19 20:24:32: ì›ê²© ì„¸ì…˜ ìƒì„± ì„±ê³µ (SessionId: 1)
2024-12-19 20:24:32: ì„¸ì…˜ ìƒíƒœ í™•ì¸ ì™„ë£Œ
2024-12-19 20:24:32: AD ì‚¬ìš©ì ìƒì„± ëª…ë ¹ ì‹¤í–‰ ì‹œì‘
2024-12-19 20:24:34: ì›ê²© ì„¸ì…˜ ì¢…ë£Œ
2024-12-19 20:24:34: ì‚¬ìš©ì ìƒì„± ì™„ë£Œ: skb
Log initialization test: 12/19/2024 20:30:10
2024-12-19 20:30:10: ìŠ¤í¬ë¦½íŠ¸ ì‹œì‘ - ê²½ë¡œ: C:\Users\woods\development\HMProject\vdi_backend\src\main\resources\scripts
2024-12-19 20:30:10: ë¡œê·¸ ë””ë ‰í† ë¦¬: C:\Users\woods\development\HMProject\vdi_backend\src\main\resources\scripts\logs
2024-12-19 20:30:10: ì‹œì‘: AD ì‚¬ìš©ì ìƒì„± - UserID: skb, Name: ê¸°ë²” ì„±
2024-12-19 20:30:10: ì›ê²© ì—°ê²° ì„¤ì • ì‹œë„ - Server: 192.168.111.10, Username: administrator@hanbit.com
2024-12-19 20:30:10: ìê²© ì¦ëª… ìƒì„± ì„±ê³µ
2024-12-19 20:30:10: ì›ê²© ì„œë²„ ì—°ê²° í…ŒìŠ¤íŠ¸ ì‹œì‘
2024-12-19 20:30:10: ì›ê²© ì„œë²„ ì—°ê²° í…ŒìŠ¤íŠ¸ ì„±ê³µ
2024-12-19 20:30:10: ì›ê²© ì„¸ì…˜ ìƒì„± ì‹œë„
2024-12-19 20:30:11: ì›ê²© ì„¸ì…˜ ìƒì„± ì„±ê³µ (SessionId: 1)
2024-12-19 20:30:11: ì„¸ì…˜ ìƒíƒœ í™•ì¸ ì™„ë£Œ
2024-12-19 20:30:11: AD ì‚¬ìš©ì ìƒì„± ëª…ë ¹ ì‹¤í–‰ ì‹œì‘
2024-12-19 20:30:12: ì›ê²© ì„¸ì…˜ ì¢…ë£Œ
2024-12-19 20:30:12: ì‚¬ìš©ì ìƒì„± ì™„ë£Œ: skb
